chat_id,chat_name,organization_id,organization_name,authorId,full_name,text,createdAt
1f09ead7-83d9-620d-a893-48fc35aa34c4,для обсуждения графиков,1ef822c2-7fd7-66cd-aa65-d7b09a6fc205,Корпорация АСК (Головная организация),1ef8c31a-9a05-6e8a-96f5-a0423f4d30a4,Светлана Семенова,доброе утро! таблица обновлена - в почте новая версия для обсуждения,2025-10-02 08:43:28
1f09ead7-83d9-620d-a893-48fc35aa34c4,для обсуждения графиков,1ef822c2-7fd7-66cd-aa65-d7b09a6fc205,Корпорация АСК (Головная организация),1ef8c31a-9a05-6e8a-96f5-a0423f4d30a4,Светлана Семенова,"будут вопросы - пишите сюда или в почту. Завтра с утра обсуждение, поэтому прошу уделить время.",2025-10-01 15:03:11
1f09ead7-83d9-620d-a893-48fc35aa34c4,для обсуждения графиков,1ef822c2-7fd7-66cd-aa65-d7b09a6fc205,Корпорация АСК (Головная организация),1ef8c31a-9a05-6e8a-96f5-a0423f4d30a4,Светлана Семенова,"Добрый день, коллеги!

Для планирования и учета всех объектов я свела текущую информацию по объектам и графикам в таблицу - высылаю в почту.
Группировка по ГИПам, далее объект и стадии. Цвета значения не имеют, полосочки показывают месяц выполнения.

Дорогие ГИПы! Сроки из графиков Примавера и новых вводных от Дины Владимировны. Если есть ошибки - пишите сразу - поправлю, чтобы не обсуждать неверную информацию.",2025-10-01 15:02:52
