chat_id,chat_name,organization_id,organization_name,authorId,full_name,text,createdAt
1f099cff-5db8-6efc-8baf-58811e7f31a2,IT-IP. Synch Крайон,1ef822c2-7fd7-66cd-aa65-d7b09a6fc205,1ef822c2-7fd7-66cd-aa65-d7b09a6fc205,1f0ad6ea-9851-68be-a14a-04421acbfbde,Синхронизация Персональная,"Персональная синхронизация: Отчет (newdoc)
Экземпляр: newdoc(https://newdoc.atomsk.ru)

Проекты: 2
Дата начала синхронизации: 18.11.2025 10:35:33
Дата окончания синхронизации: 18.11.2025 10:35:35
Длительность синхронизации: 00:00:02
Инициатор: semenova
Исполнитель: subbotina
Обновления:
	PM_Task:
		Новые: 1
		Обновленные: 0
	PM_TaskAssign:
		Новые: 1
		Обновленные 2:
Ошибки:
	PM_Task: 0
	PM_TaskAssign: 0
Полноценный отчет: https://api.atomsk.ru/ws-askservices/api/MiscMethods/files/9a5abe5a-9534-43cc-bf50-d814f51d3660",2025-11-18 15:35:39
1f099cff-5db8-6efc-8baf-58811e7f31a2,IT-IP. Synch Крайон,1ef822c2-7fd7-66cd-aa65-d7b09a6fc205,1ef822c2-7fd7-66cd-aa65-d7b09a6fc205,1f0ad6ea-9851-68be-a14a-04421acbfbde,Синхронизация Персональная,"Персональная синхронизация: Отчет (newdoc)
Экземпляр: newdoc(https://newdoc.atomsk.ru)

Проекты: 2
Дата начала синхронизации: 18.11.2025 9:21:18
Дата окончания синхронизации: 18.11.2025 9:21:19
Длительность синхронизации: 00:00:01
Инициатор: semenova
Исполнитель: kokoulin
Обновления:
	PM_Task:
		Новые: 0
		Обновленные: 1
	PM_TaskAssign:
		Новые: 1
		Обновленные 1:
Ошибки:
	PM_Task: 0
	PM_TaskAssign: 0
Полноценный отчет: https://api.atomsk.ru/ws-askservices/api/MiscMethods/files/39757d79-22c0-4708-b0d3-62243793ce54",2025-11-18 14:21:43
1f099cff-5db8-6efc-8baf-58811e7f31a2,IT-IP. Synch Крайон,1ef822c2-7fd7-66cd-aa65-d7b09a6fc205,1ef822c2-7fd7-66cd-aa65-d7b09a6fc205,1f0ad6ea-9851-68be-a14a-04421acbfbde,Синхронизация Персональная,"Персональная синхронизация: Отчет (newdoc)
Экземпляр: newdoc(https://newdoc.atomsk.ru)

sProjectId: Empty
sProjectGuid: Empty
sRobotNm: levv
dtStarted: 18.11.2025 9:10:05
dtFinished: 18.11.2025 4:10:05
dtExecutionTime: -05:00:00
jTasks_Entry: {
  ""TasksCnt"": null,
  ""ActivitiesCnt"": null,
  ""TasksToCreateCnt"": null,
  ""TasksToEditCnt"": null
}
jTasks_Result: {
  ""NewTasksCnt"": null,
  ""ErrorTasksCnt"": null,
  ""UpdatedTasksCnt"": null,
  ""ErrorUpdTasksCnt"": null,
  ""Finished"": null
}
iTasksErrors_Cnt: 0
jTaskAssigns_Entry: {
  ""TaskAssignsCnt"": null,
  ""RsrcAssignmentsCnt"": null,
  ""TaskAssignsToCreateCnt"": null,
  ""TaskAssignsToEditCnt"": null
}
jTaskAssigns_Result: {
  ""NewTaskAssignsCnt"": null,
  ""ErrorTaskAssignsCnt"": null,
  ""UpdatedTaskAssignsCnt"": null,
  ""ErrorUpdTaskAssignsCnt"": null,
  ""Finished"": null
}
iTaskAssignsErrors_Cnt: 0
sExecutorAdLogin: e.melnikova
sExecutorGuid: e3cd4d52-60ec-4243-b877-838ac135e64a
",2025-11-18 09:10:08
1f099cff-5db8-6efc-8baf-58811e7f31a2,IT-IP. Synch Крайон,1ef822c2-7fd7-66cd-aa65-d7b09a6fc205,1ef822c2-7fd7-66cd-aa65-d7b09a6fc205,1f0ad6ea-9851-68be-a14a-04421acbfbde,Синхронизация Персональная,"Персональная синхронизация: Отчет (newdoc)
Экземпляр: newdoc(https://newdoc.atomsk.ru)

Проекты: 1
Дата начала синхронизации: 18.11.2025 3:03:53
Дата окончания синхронизации: 18.11.2025 3:03:56
Длительность синхронизации: 00:00:02
Инициатор: semenova
Исполнитель: popov
Обновления:
	PM_Task:
		Новые: 0
		Обновленные: 0
	PM_TaskAssign:
		Новые: 1
		Обновленные 1:
Ошибки:
	PM_Task: 0
	PM_TaskAssign: 0
Полноценный отчет: https://api.atomsk.ru/ws-askservices/api/MiscMethods/files/c7e6bd38-8ee4-4e24-9ed0-e87b357a345c",2025-11-18 08:04:01
1f099cff-5db8-6efc-8baf-58811e7f31a2,IT-IP. Synch Крайон,1ef822c2-7fd7-66cd-aa65-d7b09a6fc205,1ef822c2-7fd7-66cd-aa65-d7b09a6fc205,1f0ad6f8-adba-663e-999b-04421acbe57b,Синхронизация По проектам,"Экземпляр: newdoc(https://newdoc.atomsk.ru)
Синхронизация по проектам, Результаты:
Проекты: 73
Дата начала синхронизации: 17.11.2025 23:00:00
Дата окончания синхронизации: 17.11.2025 23:01:16
Длительность синхронизации: 00:01:16
Приложение: PM TSheetsKry_Refresh
Обновления:
	PM_Task:
		Новые: 0
		Обновленные: 1
	PM_TaskAssign:
		Новые: 0
		Обновленные 1:
Ошибки:
	PM_Task: 0
	PM_TaskAssign: 47
	Ошибки сопоставления Ресурсов Pimavera: 0
		Несопоставленные Ресурсы Primavera: 
Ссылка на полный отчёт: https://api.atomsk.ru/ws-askservices/api/MiscMethods/files/f3bc3bf9-b076-4487-a868-5a58a703a3d9",2025-11-18 04:01:37
1f099cff-5db8-6efc-8baf-58811e7f31a2,IT-IP. Synch Крайон,1ef822c2-7fd7-66cd-aa65-d7b09a6fc205,1ef822c2-7fd7-66cd-aa65-d7b09a6fc205,1f0bdff2-4bed-6060-84da-6cb3116537ae,Синхронизация Справочника Проекты,"Результаты синхронизации проектов Doctrix
Инициатор: sqlJob_SyncDoctrixProjects
Проекты: 4
Дата начала синхронизации: 17.11.2025 20:00:02
Дата окончания синхронизации: 17.11.2025 20:00:03
Длительность синхронизации: 00:00:01
Инициатор: sqlJob_SyncDoctrixProjects
Обновления:
	Созданные проекты: 0
	Обновленные проекты: 4
Ошибки:
	Ошибки при создании: 0
	Ошибки при обновлении: 0
Полноценный отчет: https://api.atomsk.ru/ws-askservices/api/MiscMethods/files/5f37a5a3-a85f-4504-a105-2eab67bc70f8",2025-11-18 01:00:08
1f099cff-5db8-6efc-8baf-58811e7f31a2,IT-IP. Synch Крайон,1ef822c2-7fd7-66cd-aa65-d7b09a6fc205,1ef822c2-7fd7-66cd-aa65-d7b09a6fc205,1f0bdff2-4bed-6060-84da-6cb3116537ae,Синхронизация Справочника Проекты,"Результаты синхронизации проектов Doctrix
Инициатор: sqlJob_SyncDoctrixProjects
Проекты: 4
Дата начала синхронизации: 17.11.2025 17:55:27
Дата окончания синхронизации: 17.11.2025 17:55:28
Длительность синхронизации: 00:00:01
Инициатор: sqlJob_SyncDoctrixProjects
Обновления:
	Созданные проекты: 0
	Обновленные проекты: 4
Ошибки:
	Ошибки при создании: 0
	Ошибки при обновлении: 0
Полноценный отчет: https://api.atomsk.ru/ws-askservices/api/MiscMethods/files/ff35ce45-2eef-4041-91e6-8d96e030a155",2025-11-17 22:55:29
1f099cff-5db8-6efc-8baf-58811e7f31a2,IT-IP. Synch Крайон,1ef822c2-7fd7-66cd-aa65-d7b09a6fc205,1ef822c2-7fd7-66cd-aa65-d7b09a6fc205,1f0bdff2-4bed-6060-84da-6cb3116537ae,Синхронизация Справочника Проекты,"Результаты синхронизации проектов Doctrix
Инициатор: levv
Проекты: 4
Дата начала синхронизации: 17.11.2025 17:53:08
Дата окончания синхронизации: 17.11.2025 17:53:09
Длительность синхронизации: 00:00:01
Инициатор: levv
Обновления:
	Созданные проекты: 0
	Обновленные проекты: 4
Ошибки:
	Ошибки при создании: 0
	Ошибки при обновлении: 0
Полноценный отчет: https://api.atomsk.ru/ws-askservices/api/MiscMethods/files/8c798600-7a83-4409-af19-b1bc7fc157d5",2025-11-17 22:53:12
1f099cff-5db8-6efc-8baf-58811e7f31a2,IT-IP. Synch Крайон,1ef822c2-7fd7-66cd-aa65-d7b09a6fc205,1ef822c2-7fd7-66cd-aa65-d7b09a6fc205,1f0ad6ea-9851-68be-a14a-04421acbfbde,Синхронизация Персональная,"Персональная синхронизация: Отчет (newdoc)
Экземпляр: newdoc(https://newdoc.atomsk.ru)

sProjectId: Empty
sProjectGuid: Empty
sRobotNm: levv
dtStarted: 17.11.2025 22:51:16
dtFinished: 17.11.2025 17:51:16
dtExecutionTime: -05:00:00
jTasks_Entry: {
  ""TasksCnt"": null,
  ""ActivitiesCnt"": null,
  ""TasksToCreateCnt"": null,
  ""TasksToEditCnt"": null
}
jTasks_Result: {
  ""NewTasksCnt"": null,
  ""ErrorTasksCnt"": null,
  ""UpdatedTasksCnt"": null,
  ""ErrorUpdTasksCnt"": null,
  ""Finished"": null
}
iTasksErrors_Cnt: 0
jTaskAssigns_Entry: {
  ""TaskAssignsCnt"": null,
  ""RsrcAssignmentsCnt"": null,
  ""TaskAssignsToCreateCnt"": null,
  ""TaskAssignsToEditCnt"": null
}
jTaskAssigns_Result: {
  ""NewTaskAssignsCnt"": null,
  ""ErrorTaskAssignsCnt"": null,
  ""UpdatedTaskAssignsCnt"": null,
  ""ErrorUpdTaskAssignsCnt"": null,
  ""Finished"": null
}
iTaskAssignsErrors_Cnt: 0
sExecutorAdLogin: e.melnikova
sExecutorGuid: e3cd4d52-60ec-4243-b877-838ac135e64a
",2025-11-17 22:51:16
1f099cff-5db8-6efc-8baf-58811e7f31a2,IT-IP. Synch Крайон,1ef822c2-7fd7-66cd-aa65-d7b09a6fc205,1ef822c2-7fd7-66cd-aa65-d7b09a6fc205,1f0ad6ea-9851-68be-a14a-04421acbfbde,Синхронизация Персональная,"Персональная синхронизация: Отчет (newdoc)
Экземпляр: newdoc(https://newdoc.atomsk.ru)

sProjectId: Empty
sProjectGuid: Empty
sRobotNm: levv
dtStarted: 17.11.2025 22:35:40
dtFinished: 17.11.2025 17:35:40
dtExecutionTime: -05:00:00
jTasks_Entry: {
  ""TasksCnt"": null,
  ""ActivitiesCnt"": null,
  ""TasksToCreateCnt"": null,
  ""TasksToEditCnt"": null
}
jTasks_Result: {
  ""NewTasksCnt"": null,
  ""ErrorTasksCnt"": null,
  ""UpdatedTasksCnt"": null,
  ""ErrorUpdTasksCnt"": null,
  ""Finished"": null
}
iTasksErrors_Cnt: 0
jTaskAssigns_Entry: {
  ""TaskAssignsCnt"": null,
  ""RsrcAssignmentsCnt"": null,
  ""TaskAssignsToCreateCnt"": null,
  ""TaskAssignsToEditCnt"": null
}
jTaskAssigns_Result: {
  ""NewTaskAssignsCnt"": null,
  ""ErrorTaskAssignsCnt"": null,
  ""UpdatedTaskAssignsCnt"": null,
  ""ErrorUpdTaskAssignsCnt"": null,
  ""Finished"": null
}
iTaskAssignsErrors_Cnt: 0
sExecutorAdLogin: e.barila
sExecutorGuid: 31d3f97f-d2f0-40b4-a0bb-cb4745561ec3
",2025-11-17 22:35:40
1f099cff-5db8-6efc-8baf-58811e7f31a2,IT-IP. Synch Крайон,1ef822c2-7fd7-66cd-aa65-d7b09a6fc205,1ef822c2-7fd7-66cd-aa65-d7b09a6fc205,1f0ad6f8-adba-663e-999b-04421acbe57b,Синхронизация По проектам,"Экземпляр: newdoc(https://newdoc.atomsk.ru)
Синхронизация по проектам, Результаты:
Проекты: 73
Дата начала синхронизации: 17.11.2025 17:00:00
Дата окончания синхронизации: 17.11.2025 17:29:51
Длительность синхронизации: 00:29:50
Приложение: PM TSheetsKry_Refresh
Обновления:
	PM_Task:
		Новые: 1
		Обновленные: 683
	PM_TaskAssign:
		Новые: 103
		Обновленные 743:
Ошибки:
	PM_Task: 0
	PM_TaskAssign: 47
	Ошибки сопоставления Ресурсов Pimavera: 0
		Несопоставленные Ресурсы Primavera: 
Ссылка на полный отчёт: https://api.atomsk.ru/ws-askservices/api/MiscMethods/files/2500016a-2331-45de-aed4-d386c44f13d4",2025-11-17 22:30:14
1f099cff-5db8-6efc-8baf-58811e7f31a2,IT-IP. Synch Крайон,1ef822c2-7fd7-66cd-aa65-d7b09a6fc205,1ef822c2-7fd7-66cd-aa65-d7b09a6fc205,1f0bdff2-4bed-6060-84da-6cb3116537ae,Синхронизация Справочника Проекты,"Результаты синхронизации проектов Doctrix
Инициатор: levv
Проекты: 4
Дата начала синхронизации: 17.11.2025 13:29:55
Дата окончания синхронизации: 17.11.2025 13:29:57
Длительность синхронизации: 00:00:01
Инициатор: levv
Обновления:
	Созданные проекты: 0
	Обновленные проекты: 4
Ошибки:
	Ошибки при создании: 0
	Ошибки при обновлении: 0
Полноценный отчет: https://api.atomsk.ru/ws-askservices/api/MiscMethods/files/8b0533b7-d7c3-41c6-abd9-48bf9d89922f",2025-11-17 18:29:57
1f099cff-5db8-6efc-8baf-58811e7f31a2,IT-IP. Synch Крайон,1ef822c2-7fd7-66cd-aa65-d7b09a6fc205,1ef822c2-7fd7-66cd-aa65-d7b09a6fc205,1efc4285-fe29-6874-a027-d85ed36b7d02,Даниил Обухов,"Результаты синхронизации проектов Doctrix
Инициатор: levv
Проекты: 4
Дата начала синхронизации: 17.11.2025 13:26:09
Дата окончания синхронизации: 17.11.2025 13:26:10
Длительность синхронизации: 00:00:01
Инициатор: levv
Обновления:
	Созданные проекты: 0
	Обновленные проекты: 4
Ошибки:
	Ошибки при создании: 0
	Ошибки при обновлении: 0
Полноценный отчет: https://api.atomsk.ru/ws-askservices/api/MiscMethods/files/42471e7b-fbbd-4593-abef-a494454c4944",2025-11-17 18:26:14
1f099cff-5db8-6efc-8baf-58811e7f31a2,IT-IP. Synch Крайон,1ef822c2-7fd7-66cd-aa65-d7b09a6fc205,1ef822c2-7fd7-66cd-aa65-d7b09a6fc205,1f0ad6f8-adba-663e-999b-04421acbe57b,Синхронизация По проектам,"Экземпляр: newdoc(https://newdoc.atomsk.ru)
Синхронизация по проектам, Результаты:
Проекты: 73
Дата начала синхронизации: 16.11.2025 23:00:00
Дата окончания синхронизации: 16.11.2025 23:01:10
Длительность синхронизации: 00:01:10
Приложение: PM TSheetsKry_Refresh
Обновления:
	PM_Task:
		Новые: 0
		Обновленные: 0
	PM_TaskAssign:
		Новые: 0
		Обновленные 0:
Ошибки:
	PM_Task: 0
	PM_TaskAssign: 47
	Ошибки сопоставления Ресурсов Pimavera: 0
		Несопоставленные Ресурсы Primavera: 
Ссылка на полный отчёт: https://api.atomsk.ru/ws-askservices/api/MiscMethods/files/8cc6fb2e-6f63-45e7-9710-136852439810",2025-11-17 04:01:33
1f099cff-5db8-6efc-8baf-58811e7f31a2,IT-IP. Synch Крайон,1ef822c2-7fd7-66cd-aa65-d7b09a6fc205,1ef822c2-7fd7-66cd-aa65-d7b09a6fc205,1f0ad6f8-adba-663e-999b-04421acbe57b,Синхронизация По проектам,"Экземпляр: newdoc(https://newdoc.atomsk.ru)
Синхронизация по проектам, Результаты:
Проекты: 73
Дата начала синхронизации: 16.11.2025 17:00:00
Дата окончания синхронизации: 16.11.2025 17:01:24
Длительность синхронизации: 00:01:24
Приложение: PM TSheetsKry_Refresh
Обновления:
	PM_Task:
		Новые: 0
		Обновленные: 5
	PM_TaskAssign:
		Новые: 0
		Обновленные 11:
Ошибки:
	PM_Task: 0
	PM_TaskAssign: 47
	Ошибки сопоставления Ресурсов Pimavera: 0
		Несопоставленные Ресурсы Primavera: 
Ссылка на полный отчёт: https://api.atomsk.ru/ws-askservices/api/MiscMethods/files/37a38c13-aab3-4df3-8c17-9d5b8a543563",2025-11-16 22:01:50
1f099cff-5db8-6efc-8baf-58811e7f31a2,IT-IP. Synch Крайон,1ef822c2-7fd7-66cd-aa65-d7b09a6fc205,1ef822c2-7fd7-66cd-aa65-d7b09a6fc205,1f0ad6f8-adba-663e-999b-04421acbe57b,Синхронизация По проектам,"Экземпляр: newdoc(https://newdoc.atomsk.ru)
Синхронизация по проектам, Результаты:
Проекты: 73
Дата начала синхронизации: 15.11.2025 23:00:00
Дата окончания синхронизации: 15.11.2025 23:01:05
Длительность синхронизации: 00:01:05
Приложение: PM TSheetsKry_Refresh
Обновления:
	PM_Task:
		Новые: 0
		Обновленные: 0
	PM_TaskAssign:
		Новые: 0
		Обновленные 0:
Ошибки:
	PM_Task: 0
	PM_TaskAssign: 47
	Ошибки сопоставления Ресурсов Pimavera: 0
		Несопоставленные Ресурсы Primavera: 
Ссылка на полный отчёт: https://api.atomsk.ru/ws-askservices/api/MiscMethods/files/cd5584a1-bdb7-4e40-968e-21424465310d",2025-11-16 04:01:27
1f099cff-5db8-6efc-8baf-58811e7f31a2,IT-IP. Synch Крайон,1ef822c2-7fd7-66cd-aa65-d7b09a6fc205,1ef822c2-7fd7-66cd-aa65-d7b09a6fc205,1f0ad6f8-adba-663e-999b-04421acbe57b,Синхронизация По проектам,"Экземпляр: newdoc(https://newdoc.atomsk.ru)
Синхронизация по проектам, Результаты:
Проекты: 73
Дата начала синхронизации: 15.11.2025 17:00:01
Дата окончания синхронизации: 15.11.2025 17:01:35
Длительность синхронизации: 00:01:34
Приложение: PM TSheetsKry_Refresh
Обновления:
	PM_Task:
		Новые: 0
		Обновленные: 7
	PM_TaskAssign:
		Новые: 0
		Обновленные 8:
Ошибки:
	PM_Task: 0
	PM_TaskAssign: 47
	Ошибки сопоставления Ресурсов Pimavera: 0
		Несопоставленные Ресурсы Primavera: 
Ссылка на полный отчёт: https://api.atomsk.ru/ws-askservices/api/MiscMethods/files/cc12f1f8-aaf9-493c-986f-082da3cbdcbf",2025-11-15 22:02:09
1f099cff-5db8-6efc-8baf-58811e7f31a2,IT-IP. Synch Крайон,1ef822c2-7fd7-66cd-aa65-d7b09a6fc205,1ef822c2-7fd7-66cd-aa65-d7b09a6fc205,1f0ad6f8-adba-663e-999b-04421acbe57b,Синхронизация По проектам,"Экземпляр: newdoc(https://newdoc.atomsk.ru)
Синхронизация по проектам, Результаты:
Проекты: 73
Дата начала синхронизации: 14.11.2025 23:00:01
Дата окончания синхронизации: 14.11.2025 23:01:09
Длительность синхронизации: 00:01:08
Приложение: PM TSheetsKry_Refresh
Обновления:
	PM_Task:
		Новые: 0
		Обновленные: 0
	PM_TaskAssign:
		Новые: 0
		Обновленные 0:
Ошибки:
	PM_Task: 0
	PM_TaskAssign: 47
	Ошибки сопоставления Ресурсов Pimavera: 0
		Несопоставленные Ресурсы Primavera: 
Ссылка на полный отчёт: https://api.atomsk.ru/ws-askservices/api/MiscMethods/files/7752ebf8-0543-4d6f-a2f0-f2b41f70a4d2",2025-11-15 04:01:33
1f099cff-5db8-6efc-8baf-58811e7f31a2,IT-IP. Synch Крайон,1ef822c2-7fd7-66cd-aa65-d7b09a6fc205,1ef822c2-7fd7-66cd-aa65-d7b09a6fc205,1f0ad6f8-adba-663e-999b-04421acbe57b,Синхронизация По проектам,"Экземпляр: newdoc(https://newdoc.atomsk.ru)
Синхронизация по проектам, Результаты:
Проекты: 73
Дата начала синхронизации: 14.11.2025 17:00:00
Дата окончания синхронизации: 14.11.2025 17:10:08
Длительность синхронизации: 00:10:07
Приложение: PM TSheetsKry_Refresh
Обновления:
	PM_Task:
		Новые: 3
		Обновленные: 173
	PM_TaskAssign:
		Новые: 2
		Обновленные 266:
Ошибки:
	PM_Task: 0
	PM_TaskAssign: 47
	Ошибки сопоставления Ресурсов Pimavera: 0
		Несопоставленные Ресурсы Primavera: 
Ссылка на полный отчёт: https://api.atomsk.ru/ws-askservices/api/MiscMethods/files/ae1ba2bb-5523-42b1-84d7-17572e4d3d5c",2025-11-14 22:10:32
1f099cff-5db8-6efc-8baf-58811e7f31a2,IT-IP. Synch Крайон,1ef822c2-7fd7-66cd-aa65-d7b09a6fc205,1ef822c2-7fd7-66cd-aa65-d7b09a6fc205,1f0ad6f8-adba-663e-999b-04421acbe57b,Синхронизация По проектам,"Экземпляр: newdoc(https://newdoc.atomsk.ru)
Синхронизация по проектам, Результаты:
Проекты: 73
Дата начала синхронизации: 13.11.2025 17:00:01
Дата окончания синхронизации: 13.11.2025 18:10:45
Длительность синхронизации: 01:10:44
Приложение: PM TSheetsKry_Refresh
Обновления:
	PM_Task:
		Новые: 2
		Обновленные: 3214
	PM_TaskAssign:
		Новые: 0
		Обновленные 508:
Ошибки:
	PM_Task: 0
	PM_TaskAssign: 47
	Ошибки сопоставления Ресурсов Pimavera: 0
		Несопоставленные Ресурсы Primavera: 
Ссылка на полный отчёт: https://api.atomsk.ru/ws-askservices/api/MiscMethods/files/07578e06-ddd0-4b59-bc21-acd9d25c72fb",2025-11-13 23:11:09
1f099cff-5db8-6efc-8baf-58811e7f31a2,IT-IP. Synch Крайон,1ef822c2-7fd7-66cd-aa65-d7b09a6fc205,1ef822c2-7fd7-66cd-aa65-d7b09a6fc205,1f0ad6f8-adba-663e-999b-04421acbe57b,Синхронизация По проектам,"Экземпляр: newdoc(https://newdoc.atomsk.ru)
Синхронизация по проектам, Результаты:
Проекты: 1
Дата начала синхронизации: 13.11.2025 7:07:49
Дата окончания синхронизации: 13.11.2025 7:07:53
Длительность синхронизации: 00:00:03
Приложение: PM TSheetsKry_Refresh
Обновления:
	PM_Task:
		Новые: 0
		Обновленные: 0
	PM_TaskAssign:
		Новые: 0
		Обновленные 0:
Ошибки:
	PM_Task: 0
	PM_TaskAssign: 0
	Ошибки сопоставления Ресурсов Pimavera: 0
		Несопоставленные Ресурсы Primavera: 
Ссылка на полный отчёт: https://api.atomsk.ru/ws-askservices/api/MiscMethods/files/6500e7d0-2ad6-42a7-a970-bbd0754dac0d",2025-11-13 12:08:08
1f099cff-5db8-6efc-8baf-58811e7f31a2,IT-IP. Synch Крайон,1ef822c2-7fd7-66cd-aa65-d7b09a6fc205,1ef822c2-7fd7-66cd-aa65-d7b09a6fc205,1f0ad6f8-adba-663e-999b-04421acbe57b,Синхронизация По проектам,"Экземпляр: newdoc(https://newdoc.atomsk.ru)
Синхронизация по проектам, Результаты:
Проекты: 1
Дата начала синхронизации: 13.11.2025 7:04:17
Дата окончания синхронизации: 13.11.2025 7:04:31
Длительность синхронизации: 00:00:13
Приложение: PM TSheetsKry_Refresh
Обновления:
	PM_Task:
		Новые: 0
		Обновленные: 0
	PM_TaskAssign:
		Новые: 0
		Обновленные 0:
Ошибки:
	PM_Task: 0
	PM_TaskAssign: 0
	Ошибки сопоставления Ресурсов Pimavera: 0
		Несопоставленные Ресурсы Primavera: 
Ссылка на полный отчёт: https://api.atomsk.ru/ws-askservices/api/MiscMethods/files/121be2cc-836a-4890-897f-6dd93b3b9a98",2025-11-13 12:04:54
1f099cff-5db8-6efc-8baf-58811e7f31a2,IT-IP. Synch Крайон,1ef822c2-7fd7-66cd-aa65-d7b09a6fc205,1ef822c2-7fd7-66cd-aa65-d7b09a6fc205,1f0ad6f8-adba-663e-999b-04421acbe57b,Синхронизация По проектам,"Экземпляр: newdoc(https://newdoc.atomsk.ru)
Синхронизация по проектам, Результаты:
Проекты: 31
Дата начала синхронизации: 12.11.2025 23:00:01
Дата окончания синхронизации: 12.11.2025 23:01:14
Длительность синхронизации: 00:01:13
Приложение: PM TSheetsKry_Refresh
Обновления:
	PM_Task:
		Новые: 0
		Обновленные: 0
	PM_TaskAssign:
		Новые: 0
		Обновленные 0:
Ошибки:
	PM_Task: 0
	PM_TaskAssign: 47
	Ошибки сопоставления Ресурсов Pimavera: 0
		Несопоставленные Ресурсы Primavera: 
",2025-11-13 04:01:33
1f099cff-5db8-6efc-8baf-58811e7f31a2,IT-IP. Synch Крайон,1ef822c2-7fd7-66cd-aa65-d7b09a6fc205,1ef822c2-7fd7-66cd-aa65-d7b09a6fc205,1f0ad6f8-adba-663e-999b-04421acbe57b,Синхронизация По проектам,"Экземпляр: newdoc(https://newdoc.atomsk.ru)
Синхронизация по проектам, Результаты:
Проекты: 1
Дата начала синхронизации: 12.11.2025 12:53:58
Дата окончания синхронизации: 12.11.2025 12:54:05
Длительность синхронизации: 00:00:08
Приложение: D4615-A TSheetsKry_Refresh
Обновления:
	PM_Task:
		Новые: 0
		Обновленные: 2
	PM_TaskAssign:
		Новые: 0
		Обновленные 3:
Ошибки:
	PM_Task: 0
	PM_TaskAssign: 0
	Ошибки сопоставления Ресурсов Pimavera: 0
		Несопоставленные Ресурсы Primavera: 
Ссылка на полный отчёт: https://api.atomsk.ru/ws-askservices/api/MiscMethods/files/0c301515-a0c7-4fe1-bbe2-f2f08e7232d2",2025-11-12 17:54:24
1f099cff-5db8-6efc-8baf-58811e7f31a2,IT-IP. Synch Крайон,1ef822c2-7fd7-66cd-aa65-d7b09a6fc205,1ef822c2-7fd7-66cd-aa65-d7b09a6fc205,1f0ad6f8-adba-663e-999b-04421acbe57b,Синхронизация По проектам,"Экземпляр: newdoc(https://newdoc.atomsk.ru)
Синхронизация по проектам, Результаты:
Проекты: 1
Дата начала синхронизации: 12.11.2025 12:24:56
Дата окончания синхронизации: 12.11.2025 12:25:04
Длительность синхронизации: 00:00:08
Приложение: D4615-A TSheetsKry_Refresh
Обновления:
	PM_Task:
		Новые: 1
		Обновленные: 1
	PM_TaskAssign:
		Новые: 2
		Обновленные 1:
Ошибки:
	PM_Task: 0
	PM_TaskAssign: 0
	Ошибки сопоставления Ресурсов Pimavera: 0
		Несопоставленные Ресурсы Primavera: 
Ссылка на полный отчёт: https://api.atomsk.ru/ws-askservices/api/MiscMethods/files/3a8ed37b-6383-4894-a0c2-9f1055b6b051",2025-11-12 17:25:20
1f099cff-5db8-6efc-8baf-58811e7f31a2,IT-IP. Synch Крайон,1ef822c2-7fd7-66cd-aa65-d7b09a6fc205,1ef822c2-7fd7-66cd-aa65-d7b09a6fc205,1f0ad6f8-adba-663e-999b-04421acbe57b,Синхронизация По проектам,"Экземпляр: newdoc(https://newdoc.atomsk.ru)
Синхронизация по проектам, Результаты:
Проекты: 1
Дата начала синхронизации: 12.11.2025 12:19:46
Дата окончания синхронизации: 12.11.2025 12:19:52
Длительность синхронизации: 00:00:06
Приложение: D4615-A TSheetsKry_Refresh
Обновления:
	PM_Task:
		Новые: 0
		Обновленные: 1
	PM_TaskAssign:
		Новые: 0
		Обновленные 2:
Ошибки:
	PM_Task: 0
	PM_TaskAssign: 0
	Ошибки сопоставления Ресурсов Pimavera: 0
		Несопоставленные Ресурсы Primavera: 
Ссылка на полный отчёт: https://api.atomsk.ru/ws-askservices/api/MiscMethods/files/469a1492-515c-4bc3-b497-a07b2b4f07b2",2025-11-12 17:20:08
1f099cff-5db8-6efc-8baf-58811e7f31a2,IT-IP. Synch Крайон,1ef822c2-7fd7-66cd-aa65-d7b09a6fc205,1ef822c2-7fd7-66cd-aa65-d7b09a6fc205,1f0ad6f8-adba-663e-999b-04421acbe57b,Синхронизация По проектам,"Экземпляр: newdoc(https://newdoc.atomsk.ru)
Синхронизация по проектам, Результаты:
Проекты: 1
Дата начала синхронизации: 12.11.2025 12:16:35
Дата окончания синхронизации: 12.11.2025 12:16:41
Длительность синхронизации: 00:00:06
Приложение: D4615-A TSheetsKry_Refresh
Обновления:
	PM_Task:
		Новые: 0
		Обновленные: 1
	PM_TaskAssign:
		Новые: 0
		Обновленные 2:
Ошибки:
	PM_Task: 0
	PM_TaskAssign: 0
	Ошибки сопоставления Ресурсов Pimavera: 0
		Несопоставленные Ресурсы Primavera: 
Ссылка на полный отчёт: https://api.atomsk.ru/ws-askservices/api/MiscMethods/files/d73f6dfb-63bc-4fb4-9e0d-85cd4a44ecb4",2025-11-12 17:16:57
1f099cff-5db8-6efc-8baf-58811e7f31a2,IT-IP. Synch Крайон,1ef822c2-7fd7-66cd-aa65-d7b09a6fc205,1ef822c2-7fd7-66cd-aa65-d7b09a6fc205,1f0ad6f8-adba-663e-999b-04421acbe57b,Синхронизация По проектам,"Экземпляр: newdoc(https://newdoc.atomsk.ru)
Синхронизация по проектам, Результаты:
Проекты: 1
Дата начала синхронизации: 12.11.2025 12:13:51
Дата окончания синхронизации: 12.11.2025 12:13:58
Длительность синхронизации: 00:00:06
Приложение: D4615-A TSheetsKry_Refresh
Обновления:
	PM_Task:
		Новые: 1
		Обновленные: 0
	PM_TaskAssign:
		Новые: 2
		Обновленные 0:
Ошибки:
	PM_Task: 0
	PM_TaskAssign: 0
	Ошибки сопоставления Ресурсов Pimavera: 0
		Несопоставленные Ресурсы Primavera: 
Ссылка на полный отчёт: https://api.atomsk.ru/ws-askservices/api/MiscMethods/files/1bcbcd3f-db62-4fa5-8705-65a16e08bf31",2025-11-12 17:14:14
1f099cff-5db8-6efc-8baf-58811e7f31a2,IT-IP. Synch Крайон,1ef822c2-7fd7-66cd-aa65-d7b09a6fc205,1ef822c2-7fd7-66cd-aa65-d7b09a6fc205,1f0ad6f8-adba-663e-999b-04421acbe57b,Синхронизация По проектам,"Экземпляр: newdoc(https://newdoc.atomsk.ru)
Синхронизация по проектам, Результаты:
Проекты: 1
Дата начала синхронизации: 12.11.2025 12:10:04
Дата окончания синхронизации: 12.11.2025 12:10:19
Длительность синхронизации: 00:00:15
Приложение: D4615-A TSheetsKry_Refresh
Обновления:
	PM_Task:
		Новые: 0
		Обновленные: 1
	PM_TaskAssign:
		Новые: 0
		Обновленные 10:
Ошибки:
	PM_Task: 0
	PM_TaskAssign: 0
	Ошибки сопоставления Ресурсов Pimavera: 0
		Несопоставленные Ресурсы Primavera: 
Ссылка на полный отчёт: https://api.atomsk.ru/ws-askservices/api/MiscMethods/files/46d02d86-681e-43a0-abf8-078f1be7062e",2025-11-12 17:10:43
1f099cff-5db8-6efc-8baf-58811e7f31a2,IT-IP. Synch Крайон,1ef822c2-7fd7-66cd-aa65-d7b09a6fc205,1ef822c2-7fd7-66cd-aa65-d7b09a6fc205,1f0ad6f8-adba-663e-999b-04421acbe57b,Синхронизация По проектам,"Экземпляр: newdoc(https://newdoc.atomsk.ru)
Синхронизация по проектам, Результаты:
Проекты: 35
Дата начала синхронизации: 11.11.2025 23:00:05
Дата окончания синхронизации: 11.11.2025 23:01:14
Длительность синхронизации: 00:01:10
Приложение: PM TSheetsKry_Refresh
Обновления:
	PM_Task:
		Новые: 0
		Обновленные: 0
	PM_TaskAssign:
		Новые: 0
		Обновленные 0:
Ошибки:
	PM_Task: 0
	PM_TaskAssign: 47
	Ошибки сопоставления Ресурсов Pimavera: 0
		Несопоставленные Ресурсы Primavera: 
",2025-11-12 04:01:32
1f099cff-5db8-6efc-8baf-58811e7f31a2,IT-IP. Synch Крайон,1ef822c2-7fd7-66cd-aa65-d7b09a6fc205,1ef822c2-7fd7-66cd-aa65-d7b09a6fc205,1f0ad6f8-adba-663e-999b-04421acbe57b,Синхронизация По проектам,"Экземпляр: newdoc(https://newdoc.atomsk.ru)
Синхронизация по проектам, Результаты:
Проекты: 3
Дата начала синхронизации: 11.11.2025 17:00:01
Дата окончания синхронизации: 11.11.2025 18:50:28
Длительность синхронизации: 01:50:27
Приложение: PM TSheetsKry_Refresh
Обновления:
	PM_Task:
		Новые: 5
		Обновленные: 5103
	PM_TaskAssign:
		Новые: 9
		Обновленные 1022:
Ошибки:
	PM_Task: 0
	PM_TaskAssign: 47
	Ошибки сопоставления Ресурсов Pimavera: 0
		Несопоставленные Ресурсы Primavera: 
",2025-11-11 23:50:47
1f099cff-5db8-6efc-8baf-58811e7f31a2,IT-IP. Synch Крайон,1ef822c2-7fd7-66cd-aa65-d7b09a6fc205,1ef822c2-7fd7-66cd-aa65-d7b09a6fc205,1f0ad6f8-adba-663e-999b-04421acbe57b,Синхронизация По проектам,"Экземпляр: newdoc(https://newdoc.atomsk.ru)
Синхронизация по проектам, Результаты:
Проекты: 73
Дата начала синхронизации: 11.11.2025 4:15:27
Дата окончания синхронизации: 11.11.2025 4:38:46
Длительность синхронизации: 00:23:19
Приложение: ITDEV TSheetsKry_Refresh
Обновления:
	PM_Task:
		Новые: 1
		Обновленные: 1069
	PM_TaskAssign:
		Новые: 9
		Обновленные 273:
Ошибки:
	PM_Task: 0
	PM_TaskAssign: 47
	Ошибки сопоставления Ресурсов Pimavera: 0
		Несопоставленные Ресурсы Primavera: 
Ссылка на полный отчёт: https://api.atomsk.ru/ws-askservices/api/MiscMethods/files/f47d7f72-9b54-43fe-9458-5d8df347b51c",2025-11-11 09:39:09
1f099cff-5db8-6efc-8baf-58811e7f31a2,IT-IP. Synch Крайон,1ef822c2-7fd7-66cd-aa65-d7b09a6fc205,1ef822c2-7fd7-66cd-aa65-d7b09a6fc205,1f0ad6f8-adba-663e-999b-04421acbe57b,Синхронизация По проектам,"Экземпляр: newdoc(https://newdoc.atomsk.ru)
Синхронизация по проектам, Результаты:
Проекты: 1
Дата начала синхронизации: 11.11.2025 3:55:12
Дата окончания синхронизации: 11.11.2025 3:55:16
Длительность синхронизации: 00:00:04
Приложение: ITDEV TSheetsKry_Refresh
Обновления:
	PM_Task:
		Новые: 0
		Обновленные: 0
	PM_TaskAssign:
		Новые: 0
		Обновленные 0:
Ошибки:
	PM_Task: 0
	PM_TaskAssign: 0
	Ошибки сопоставления Ресурсов Pimavera: 0
		Несопоставленные Ресурсы Primavera: 
Ссылка на полный отчёт: https://api.atomsk.ru/ws-askservices/api/MiscMethods/files/30538dfb-0c88-4259-8aa4-afa7e9e6e57b",2025-11-11 08:55:47
1f099cff-5db8-6efc-8baf-58811e7f31a2,IT-IP. Synch Крайон,1ef822c2-7fd7-66cd-aa65-d7b09a6fc205,1ef822c2-7fd7-66cd-aa65-d7b09a6fc205,1f0ad6f8-adba-663e-999b-04421acbe57b,Синхронизация По проектам,"Экземпляр: newdoc(https://newdoc.atomsk.ru)
Синхронизация по проектам, Результаты:
Проекты: 31
Дата начала синхронизации: 10.11.2025 23:00:00
Дата окончания синхронизации: 10.11.2025 23:01:13
Длительность синхронизации: 00:01:13
Приложение: PM TSheetsKry_Refresh
Обновления:
	PM_Task:
		Новые: 0
		Обновленные: 0
	PM_TaskAssign:
		Новые: 0
		Обновленные 0:
Ошибки:
	PM_Task: 0
	PM_TaskAssign: 47
	Ошибки сопоставления Ресурсов Pimavera: 0
		Несопоставленные Ресурсы Primavera: 
",2025-11-11 04:01:31
1f099cff-5db8-6efc-8baf-58811e7f31a2,IT-IP. Synch Крайон,1ef822c2-7fd7-66cd-aa65-d7b09a6fc205,1ef822c2-7fd7-66cd-aa65-d7b09a6fc205,1f0ad6f8-adba-663e-999b-04421acbe57b,Синхронизация По проектам,"Экземпляр: newdoc(https://newdoc.atomsk.ru)
Синхронизация по проектам, Результаты:
Проекты: 10
Дата начала синхронизации: 10.11.2025 17:00:01
Дата окончания синхронизации: 10.11.2025 17:13:01
Длительность синхронизации: 00:13:00
Приложение: PM TSheetsKry_Refresh
Обновления:
	PM_Task:
		Новые: 37
		Обновленные: 222
	PM_TaskAssign:
		Новые: 0
		Обновленные 371:
Ошибки:
	PM_Task: 0
	PM_TaskAssign: 47
	Ошибки сопоставления Ресурсов Pimavera: 0
		Несопоставленные Ресурсы Primavera: 
",2025-11-10 22:13:20
1f099cff-5db8-6efc-8baf-58811e7f31a2,IT-IP. Synch Крайон,1ef822c2-7fd7-66cd-aa65-d7b09a6fc205,1ef822c2-7fd7-66cd-aa65-d7b09a6fc205,1f0ad6f8-adba-663e-999b-04421acbe57b,Синхронизация По проектам,"Экземпляр: newdoc(https://newdoc.atomsk.ru)
Синхронизация по проектам, Результаты:
Проекты: 1
Дата начала синхронизации: 10.11.2025 12:56:34
Дата окончания синхронизации: 10.11.2025 12:56:41
Длительность синхронизации: 00:00:07
Приложение: D4615-A TSheetsKry_Refresh
Обновления:
	PM_Task:
		Новые: 0
		Обновленные: 1
	PM_TaskAssign:
		Новые: 0
		Обновленные 3:
Ошибки:
	PM_Task: 0
	PM_TaskAssign: 0
	Ошибки сопоставления Ресурсов Pimavera: 0
		Несопоставленные Ресурсы Primavera: 
",2025-11-10 17:56:57
1f099cff-5db8-6efc-8baf-58811e7f31a2,IT-IP. Synch Крайон,1ef822c2-7fd7-66cd-aa65-d7b09a6fc205,1ef822c2-7fd7-66cd-aa65-d7b09a6fc205,1f0ad6f8-adba-663e-999b-04421acbe57b,Синхронизация По проектам,"Экземпляр: newdoc(https://newdoc.atomsk.ru)
Синхронизация по проектам, Результаты:
Проекты: 1
Дата начала синхронизации: 10.11.2025 12:54:39
Дата окончания синхронизации: 10.11.2025 12:54:46
Длительность синхронизации: 00:00:07
Приложение: D4615-A TSheetsKry_Refresh
Обновления:
	PM_Task:
		Новые: 1
		Обновленные: 0
	PM_TaskAssign:
		Новые: 3
		Обновленные 0:
Ошибки:
	PM_Task: 0
	PM_TaskAssign: 0
	Ошибки сопоставления Ресурсов Pimavera: 0
		Несопоставленные Ресурсы Primavera: 
",2025-11-10 17:55:04
1f099cff-5db8-6efc-8baf-58811e7f31a2,IT-IP. Synch Крайон,1ef822c2-7fd7-66cd-aa65-d7b09a6fc205,1ef822c2-7fd7-66cd-aa65-d7b09a6fc205,1f0ad6f8-adba-663e-999b-04421acbe57b,Синхронизация По проектам,"Экземпляр: newdoc(https://newdoc.atomsk.ru)
Синхронизация по проектам, Результаты:
Проекты: 1
Дата начала синхронизации: 10.11.2025 12:01:11
Дата окончания синхронизации: 10.11.2025 12:01:18
Длительность синхронизации: 00:00:07
Приложение: D4615-A TSheetsKry_Refresh
Обновления:
	PM_Task:
		Новые: 0
		Обновленные: 1
	PM_TaskAssign:
		Новые: 0
		Обновленные 3:
Ошибки:
	PM_Task: 0
	PM_TaskAssign: 0
	Ошибки сопоставления Ресурсов Pimavera: 0
		Несопоставленные Ресурсы Primavera: 
",2025-11-10 17:01:34
1f099cff-5db8-6efc-8baf-58811e7f31a2,IT-IP. Synch Крайон,1ef822c2-7fd7-66cd-aa65-d7b09a6fc205,1ef822c2-7fd7-66cd-aa65-d7b09a6fc205,1f0ad6f8-adba-663e-999b-04421acbe57b,Синхронизация По проектам,"Экземпляр: newdoc(https://newdoc.atomsk.ru)
Синхронизация по проектам, Результаты:
Проекты: 1
Дата начала синхронизации: 10.11.2025 11:58:09
Дата окончания синхронизации: 10.11.2025 11:58:24
Длительность синхронизации: 00:00:15
Приложение: D4615-A TSheetsKry_Refresh
Обновления:
	PM_Task:
		Новые: 2
		Обновленные: 0
	PM_TaskAssign:
		Новые: 8
		Обновленные 0:
Ошибки:
	PM_Task: 0
	PM_TaskAssign: 2
	Ошибки сопоставления Ресурсов Pimavera: 0
		Несопоставленные Ресурсы Primavera: 
",2025-11-10 16:58:42
1f099cff-5db8-6efc-8baf-58811e7f31a2,IT-IP. Synch Крайон,1ef822c2-7fd7-66cd-aa65-d7b09a6fc205,1ef822c2-7fd7-66cd-aa65-d7b09a6fc205,1f0ad6f8-adba-663e-999b-04421acbe57b,Синхронизация По проектам,"Экземпляр: newdoc(https://newdoc.atomsk.ru)
Синхронизация по проектам, Результаты:
Проекты: 1
Дата начала синхронизации: 10.11.2025 5:41:24
Дата окончания синхронизации: 10.11.2025 5:41:29
Длительность синхронизации: 00:00:05
Приложение: ASK-IT-TP11 TSheetsKry_Refresh
Обновления:
	PM_Task:
		Новые: 0
		Обновленные: 0
	PM_TaskAssign:
		Новые: 0
		Обновленные 0:
Ошибки:
	PM_Task: 0
	PM_TaskAssign: 2
	Ошибки сопоставления Ресурсов Pimavera: 0
		Несопоставленные Ресурсы Primavera: 
",2025-11-10 10:41:47
1f099cff-5db8-6efc-8baf-58811e7f31a2,IT-IP. Synch Крайон,1ef822c2-7fd7-66cd-aa65-d7b09a6fc205,1ef822c2-7fd7-66cd-aa65-d7b09a6fc205,1f0ad6f8-adba-663e-999b-04421acbe57b,Синхронизация По проектам,"Экземпляр: newdoc(https://newdoc.atomsk.ru)
Синхронизация по проектам, Результаты:
Проекты: 31
Дата начала синхронизации: 09.11.2025 23:00:00
Дата окончания синхронизации: 09.11.2025 23:01:24
Длительность синхронизации: 00:01:24
Приложение: PM TSheetsKry_Refresh
Обновления:
	PM_Task:
		Новые: 0
		Обновленные: 2
	PM_TaskAssign:
		Новые: 0
		Обновленные 6:
Ошибки:
	PM_Task: 0
	PM_TaskAssign: 46
	Ошибки сопоставления Ресурсов Pimavera: 0
		Несопоставленные Ресурсы Primavera: 
",2025-11-10 04:01:42
1f099cff-5db8-6efc-8baf-58811e7f31a2,IT-IP. Synch Крайон,1ef822c2-7fd7-66cd-aa65-d7b09a6fc205,1ef822c2-7fd7-66cd-aa65-d7b09a6fc205,1f0ad6f8-adba-663e-999b-04421acbe57b,Синхронизация По проектам,"Экземпляр: newdoc(https://newdoc.atomsk.ru)
Синхронизация по проектам, Результаты:
Проекты: 31
Дата начала синхронизации: 09.11.2025 17:00:01
Дата окончания синхронизации: 09.11.2025 17:01:19
Длительность синхронизации: 00:01:18
Приложение: PM TSheetsKry_Refresh
Обновления:
	PM_Task:
		Новые: 0
		Обновленные: 2
	PM_TaskAssign:
		Новые: 0
		Обновленные 2:
Ошибки:
	PM_Task: 0
	PM_TaskAssign: 46
	Ошибки сопоставления Ресурсов Pimavera: 0
		Несопоставленные Ресурсы Primavera: 
",2025-11-09 22:01:39
1f099cff-5db8-6efc-8baf-58811e7f31a2,IT-IP. Synch Крайон,1ef822c2-7fd7-66cd-aa65-d7b09a6fc205,1ef822c2-7fd7-66cd-aa65-d7b09a6fc205,1f0ad6f8-adba-663e-999b-04421acbe57b,Синхронизация По проектам,"Экземпляр: newdoc(https://newdoc.atomsk.ru)
Синхронизация по проектам, Результаты:
Проекты: 43
Дата начала синхронизации: 08.11.2025 23:00:00
Дата окончания синхронизации: 08.11.2025 23:01:02
Длительность синхронизации: 00:01:02
Приложение: PM TSheetsKry_Refresh
Обновления:
	PM_Task:
		Новые: 0
		Обновленные: 0
	PM_TaskAssign:
		Новые: 0
		Обновленные 0:
Ошибки:
	PM_Task: 0
	PM_TaskAssign: 46
	Ошибки сопоставления Ресурсов Pimavera: 0
		Несопоставленные Ресурсы Primavera: 
",2025-11-09 04:01:19
1f099cff-5db8-6efc-8baf-58811e7f31a2,IT-IP. Synch Крайон,1ef822c2-7fd7-66cd-aa65-d7b09a6fc205,1ef822c2-7fd7-66cd-aa65-d7b09a6fc205,1f0ad6f8-adba-663e-999b-04421acbe57b,Синхронизация По проектам,"Экземпляр: newdoc(https://newdoc.atomsk.ru)
Синхронизация по проектам, Результаты:
Проекты: 33
Дата начала синхронизации: 08.11.2025 17:00:01
Дата окончания синхронизации: 08.11.2025 17:01:07
Длительность синхронизации: 00:01:06
Приложение: PM TSheetsKry_Refresh
Обновления:
	PM_Task:
		Новые: 0
		Обновленные: 0
	PM_TaskAssign:
		Новые: 0
		Обновленные 0:
Ошибки:
	PM_Task: 0
	PM_TaskAssign: 46
	Ошибки сопоставления Ресурсов Pimavera: 0
		Несопоставленные Ресурсы Primavera: 
",2025-11-08 22:01:25
1f099cff-5db8-6efc-8baf-58811e7f31a2,IT-IP. Synch Крайон,1ef822c2-7fd7-66cd-aa65-d7b09a6fc205,1ef822c2-7fd7-66cd-aa65-d7b09a6fc205,1f0ad6f8-adba-663e-999b-04421acbe57b,Синхронизация По проектам,"Экземпляр: newdoc(https://newdoc.atomsk.ru)
Синхронизация по проектам, Результаты:
Проекты: 36
Дата начала синхронизации: 07.11.2025 23:00:01
Дата окончания синхронизации: 07.11.2025 23:01:09
Длительность синхронизации: 00:01:08
Приложение: PM TSheetsKry_Refresh
Обновления:
	PM_Task:
		Новые: 0
		Обновленные: 0
	PM_TaskAssign:
		Новые: 0
		Обновленные 0:
Ошибки:
	PM_Task: 0
	PM_TaskAssign: 46
	Ошибки сопоставления Ресурсов Pimavera: 0
		Несопоставленные Ресурсы Primavera: 
",2025-11-08 04:01:29
1f099cff-5db8-6efc-8baf-58811e7f31a2,IT-IP. Synch Крайон,1ef822c2-7fd7-66cd-aa65-d7b09a6fc205,1ef822c2-7fd7-66cd-aa65-d7b09a6fc205,1f0ad6f8-adba-663e-999b-04421acbe57b,Синхронизация По проектам,"Экземпляр: newdoc(https://newdoc.atomsk.ru)
Синхронизация по проектам, Результаты:
Проекты: 1
Дата начала синхронизации: 07.11.2025 12:17:59
Дата окончания синхронизации: 07.11.2025 12:18:05
Длительность синхронизации: 00:00:07
Приложение: D4615-A TSheetsKry_Refresh
Обновления:
	PM_Task:
		Новые: 0
		Обновленные: 1
	PM_TaskAssign:
		Новые: 0
		Обновленные 1:
Ошибки:
	PM_Task: 0
	PM_TaskAssign: 0
	Ошибки сопоставления Ресурсов Pimavera: 0
		Несопоставленные Ресурсы Primavera: 
",2025-11-07 17:18:23
1f099cff-5db8-6efc-8baf-58811e7f31a2,IT-IP. Synch Крайон,1ef822c2-7fd7-66cd-aa65-d7b09a6fc205,1ef822c2-7fd7-66cd-aa65-d7b09a6fc205,1f0ad6f8-adba-663e-999b-04421acbe57b,Синхронизация По проектам,"Экземпляр: newdoc(https://newdoc.atomsk.ru)
Синхронизация по проектам, Результаты:
Проекты: 1
Дата начала синхронизации: 07.11.2025 11:20:57
Дата окончания синхронизации: 07.11.2025 11:21:02
Длительность синхронизации: 00:00:04
Приложение: D4615-A TSheetsKry_Refresh
Обновления:
	PM_Task:
		Новые: 0
		Обновленные: 1
	PM_TaskAssign:
		Новые: 0
		Обновленные 0:
Ошибки:
	PM_Task: 0
	PM_TaskAssign: 1
	Ошибки сопоставления Ресурсов Pimavera: 0
		Несопоставленные Ресурсы Primavera: 
",2025-11-07 16:21:17
1f099cff-5db8-6efc-8baf-58811e7f31a2,IT-IP. Synch Крайон,1ef822c2-7fd7-66cd-aa65-d7b09a6fc205,1ef822c2-7fd7-66cd-aa65-d7b09a6fc205,1f0ad6f8-adba-663e-999b-04421acbe57b,Синхронизация По проектам,"Экземпляр: newdoc(https://newdoc.atomsk.ru)
Синхронизация по проектам, Результаты:
Проекты: 1
Дата начала синхронизации: 07.11.2025 11:20:11
Дата окончания синхронизации: 07.11.2025 11:20:13
Длительность синхронизации: 00:00:03
Приложение: D4615-A TSheetsKry_Refresh
Обновления:
	PM_Task:
		Новые: 0
		Обновленные: 0
	PM_TaskAssign:
		Новые: 0
		Обновленные 0:
Ошибки:
	PM_Task: 0
	PM_TaskAssign: 0
	Ошибки сопоставления Ресурсов Pimavera: 0
		Несопоставленные Ресурсы Primavera: 
",2025-11-07 16:20:34
1f099cff-5db8-6efc-8baf-58811e7f31a2,IT-IP. Synch Крайон,1ef822c2-7fd7-66cd-aa65-d7b09a6fc205,1ef822c2-7fd7-66cd-aa65-d7b09a6fc205,1f0ad6f8-adba-663e-999b-04421acbe57b,Синхронизация По проектам,"Экземпляр: newdoc(https://newdoc.atomsk.ru)
Синхронизация по проектам, Результаты:
Проекты: 73
Дата начала синхронизации: 07.11.2025 11:05:20
Дата окончания синхронизации: 07.11.2025 11:06:48
Длительность синхронизации: 00:01:28
Приложение: D4615-A TSheetsKry_Refresh
Обновления:
	PM_Task:
		Новые: 2
		Обновленные: 4
	PM_TaskAssign:
		Новые: 0
		Обновленные 0:
Ошибки:
	PM_Task: 0
	PM_TaskAssign: 52
	Ошибки сопоставления Ресурсов Pimavera: 0
		Несопоставленные Ресурсы Primavera: 
",2025-11-07 16:07:06
1f099cff-5db8-6efc-8baf-58811e7f31a2,IT-IP. Synch Крайон,1ef822c2-7fd7-66cd-aa65-d7b09a6fc205,1ef822c2-7fd7-66cd-aa65-d7b09a6fc205,1f0ad6f8-adba-663e-999b-04421acbe57b,Синхронизация По проектам,"Экземпляр: newdoc(https://newdoc.atomsk.ru)
Синхронизация по проектам, Результаты:
Проекты: 73
Дата начала синхронизации: 07.11.2025 9:25:05
Дата окончания синхронизации: 07.11.2025 9:33:54
Длительность синхронизации: 00:08:50
Приложение: ITDEV TSheetsKry_Refresh
Обновления:
	PM_Task:
		Новые: 36
		Обновленные: 128
	PM_TaskAssign:
		Новые: 2
		Обновленные 239:
Ошибки:
	PM_Task: 0
	PM_TaskAssign: 46
	Ошибки сопоставления Ресурсов Pimavera: 0
		Несопоставленные Ресурсы Primavera: 
",2025-11-07 14:34:10
1f099cff-5db8-6efc-8baf-58811e7f31a2,IT-IP. Synch Крайон,1ef822c2-7fd7-66cd-aa65-d7b09a6fc205,1ef822c2-7fd7-66cd-aa65-d7b09a6fc205,1f0ad6f8-adba-663e-999b-04421acbe57b,Синхронизация По проектам,"Экземпляр: newdoc(https://newdoc.atomsk.ru)
Синхронизация по проектам, Результаты:
Проекты: 1
Дата начала синхронизации: 07.11.2025 9:24:23
Дата окончания синхронизации: 07.11.2025 9:24:27
Длительность синхронизации: 00:00:04
Приложение: ITDEV TSheetsKry_Refresh
Обновления:
	PM_Task:
		Новые: 0
		Обновленные: 0
	PM_TaskAssign:
		Новые: 0
		Обновленные 0:
Ошибки:
	PM_Task: 0
	PM_TaskAssign: 0
	Ошибки сопоставления Ресурсов Pimavera: 0
		Несопоставленные Ресурсы Primavera: 
",2025-11-07 14:24:43
1f099cff-5db8-6efc-8baf-58811e7f31a2,IT-IP. Synch Крайон,1ef822c2-7fd7-66cd-aa65-d7b09a6fc205,1ef822c2-7fd7-66cd-aa65-d7b09a6fc205,1f0ad6f8-adba-663e-999b-04421acbe57b,Синхронизация По проектам,"Экземпляр: newdoc(https://newdoc.atomsk.ru)
Синхронизация по проектам, Результаты:
Проекты: 1
Дата начала синхронизации: 07.11.2025 6:38:40
Дата окончания синхронизации: 07.11.2025 6:38:45
Длительность синхронизации: 00:00:05
Приложение: D4615-A TSheetsKry_Refresh
Обновления:
	PM_Task:
		Новые: 0
		Обновленные: 0
	PM_TaskAssign:
		Новые: 0
		Обновленные 0:
Ошибки:
	PM_Task: 0
	PM_TaskAssign: 0
	Ошибки сопоставления Ресурсов Pimavera: 0
		Несопоставленные Ресурсы Primavera: 
",2025-11-07 11:39:00
1f099cff-5db8-6efc-8baf-58811e7f31a2,IT-IP. Synch Крайон,1ef822c2-7fd7-66cd-aa65-d7b09a6fc205,1ef822c2-7fd7-66cd-aa65-d7b09a6fc205,1f0ad6f8-adba-663e-999b-04421acbe57b,Синхронизация По проектам,"Cинхронизация по Проектам выполнена, время выполнения 1 минута 15''.
По состоянию на 04:02 07.11.2025:
	Проекты: 73.
	Ошибки отсутствия сопоставления Ресурсов: 45",2025-11-07 09:53:14
1f099cff-5db8-6efc-8baf-58811e7f31a2,IT-IP. Synch Крайон,1ef822c2-7fd7-66cd-aa65-d7b09a6fc205,1ef822c2-7fd7-66cd-aa65-d7b09a6fc205,1f0ad6f8-adba-663e-999b-04421acbe57b,Синхронизация По проектам,"Экземпляр: newdoc(https://newdoc.atomsk.ru)
Синхронизация по проектам, Результаты:
Проекты: 31
Дата начала синхронизации: 06.11.2025 23:00:00
Дата окончания синхронизации: 06.11.2025 23:01:16
Длительность синхронизации: 00:01:15
Приложение: PM TSheetsKry_Refresh
Обновления:
	PM_Task:
		Новые: 0
		Обновленные: 0
	PM_TaskAssign:
		Новые: 0
		Обновленные 0:
Ошибки:
	PM_Task: 0
	PM_TaskAssign: 45
	Ошибки сопоставления Ресурсов Pimavera: 0
		Несопоставленные Ресурсы Primavera: 
",2025-11-07 04:01:41
1f099cff-5db8-6efc-8baf-58811e7f31a2,IT-IP. Synch Крайон,1ef822c2-7fd7-66cd-aa65-d7b09a6fc205,1ef822c2-7fd7-66cd-aa65-d7b09a6fc205,1f0ad6f8-adba-663e-999b-04421acbe57b,Синхронизация По проектам,"Экземпляр: newdoc(https://newdoc.atomsk.ru)
Синхронизация по проектам, Результаты:
Проекты: 5
Дата начала синхронизации: 06.11.2025 17:00:01
Дата окончания синхронизации: 06.11.2025 17:05:38
Длительность синхронизации: 00:05:37
Приложение: PM TSheetsKry_Refresh
Обновления:
	PM_Task:
		Новые: 8
		Обновленные: 112
	PM_TaskAssign:
		Новые: 44
		Обновленные 99:
Ошибки:
	PM_Task: 0
	PM_TaskAssign: 45
	Ошибки сопоставления Ресурсов Pimavera: 0
		Несопоставленные Ресурсы Primavera: 
",2025-11-06 22:05:57
1f099cff-5db8-6efc-8baf-58811e7f31a2,IT-IP. Synch Крайон,1ef822c2-7fd7-66cd-aa65-d7b09a6fc205,1ef822c2-7fd7-66cd-aa65-d7b09a6fc205,1f0ad6f8-adba-663e-999b-04421acbe57b,Синхронизация По проектам,"Экземпляр: newdoc(https://newdoc.atomsk.ru)
Синхронизация по проектам, Результаты:
Проекты: 73
Дата начала синхронизации: 06.11.2025 5:25:47
Дата окончания синхронизации: 06.11.2025 5:37:58
Длительность синхронизации: 00:12:11
Приложение: ITDEV TSheetsKry_Refresh
Обновления:
	PM_Task:
		Новые: 4
		Обновленные: 549
	PM_TaskAssign:
		Новые: 9
		Обновленные 164:
Ошибки:
	PM_Task: 0
	PM_TaskAssign: 45
	Ошибки сопоставления Ресурсов Pimavera: 0
		Несопоставленные Ресурсы Primavera: 
",2025-11-06 10:38:15
1f099cff-5db8-6efc-8baf-58811e7f31a2,IT-IP. Synch Крайон,1ef822c2-7fd7-66cd-aa65-d7b09a6fc205,1ef822c2-7fd7-66cd-aa65-d7b09a6fc205,1f0ad6f8-adba-663e-999b-04421acbe57b,Синхронизация По проектам,"Экземпляр: newdoc(https://newdoc.atomsk.ru)
Синхронизация по проектам, Результаты:
Проекты: 73
Дата начала синхронизации: 06.11.2025 5:03:59
Дата окончания синхронизации: 06.11.2025 5:05:51
Длительность синхронизации: 00:01:52
Приложение: ITDEV TSheetsKry_Refresh
Обновления:
	PM_Task:
		Новые: 0
		Обновленные: 19
	PM_TaskAssign:
		Новые: 18
		Обновленные 1:
Ошибки:
	PM_Task: 0
	PM_TaskAssign: 45
	Ошибки сопоставления Ресурсов Pimavera: 0
		Несопоставленные Ресурсы Primavera: 
",2025-11-06 10:06:18
1f099cff-5db8-6efc-8baf-58811e7f31a2,IT-IP. Synch Крайон,1ef822c2-7fd7-66cd-aa65-d7b09a6fc205,1ef822c2-7fd7-66cd-aa65-d7b09a6fc205,1f0ad6f8-adba-663e-999b-04421acbe57b,Синхронизация По проектам,"Экземпляр: newdoc(https://newdoc.atomsk.ru)
Синхронизация по проектам, Результаты:
Проекты: 36
Дата начала синхронизации: 06.11.2025 4:53:30
Дата окончания синхронизации: 06.11.2025 4:56:59
Длительность синхронизации: 00:03:29
Приложение: ITDEV TSheetsKry_Refresh
Обновления:
	PM_Task:
		Новые: 0
		Обновленные: 81
	PM_TaskAssign:
		Новые: 65
		Обновленные 2:
Ошибки:
	PM_Task: 0
	PM_TaskAssign: 45
	Ошибки сопоставления Ресурсов Pimavera: 0
		Несопоставленные Ресурсы Primavera: 
",2025-11-06 09:57:27
1f099cff-5db8-6efc-8baf-58811e7f31a2,IT-IP. Synch Крайон,1ef822c2-7fd7-66cd-aa65-d7b09a6fc205,1ef822c2-7fd7-66cd-aa65-d7b09a6fc205,1f0ad6f8-adba-663e-999b-04421acbe57b,Синхронизация По проектам,"Экземпляр: newdoc(https://newdoc.atomsk.ru)
Синхронизация по проектам, Результаты:
Проекты: 31
Дата начала синхронизации: 05.11.2025 23:00:00
Дата окончания синхронизации: 05.11.2025 23:01:11
Длительность синхронизации: 00:01:11
Приложение: PM TSheetsKry_Refresh
Обновления:
	PM_Task:
		Новые: 0
		Обновленные: 0
	PM_TaskAssign:
		Новые: 0
		Обновленные 0:
Ошибки:
	PM_Task: 0
	PM_TaskAssign: 45
	Ошибки сопоставления Ресурсов Pimavera: 0
		Несопоставленные Ресурсы Primavera: 
",2025-11-06 04:01:06
1f099cff-5db8-6efc-8baf-58811e7f31a2,IT-IP. Synch Крайон,1ef822c2-7fd7-66cd-aa65-d7b09a6fc205,1ef822c2-7fd7-66cd-aa65-d7b09a6fc205,1f0ad6f8-adba-663e-999b-04421acbe57b,Синхронизация По проектам,"Экземпляр: newdoc(https://newdoc.atomsk.ru)
Синхронизация по проектам, Результаты:
Проекты: 1
Дата начала синхронизации: 05.11.2025 17:00:01
Дата окончания синхронизации: 05.11.2025 18:58:19
Длительность синхронизации: 01:58:18
Приложение: PM TSheetsKry_Refresh
Обновления:
	PM_Task:
		Новые: 6
		Обновленные: 6131
	PM_TaskAssign:
		Новые: 75
		Обновленные 1177:
Ошибки:
	PM_Task: 0
	PM_TaskAssign: 45
	Ошибки сопоставления Ресурсов Pimavera: 0
		Несопоставленные Ресурсы Primavera: 
",2025-11-05 23:58:41
1f099cff-5db8-6efc-8baf-58811e7f31a2,IT-IP. Synch Крайон,1ef822c2-7fd7-66cd-aa65-d7b09a6fc205,1ef822c2-7fd7-66cd-aa65-d7b09a6fc205,1f0ad6f8-adba-663e-999b-04421acbe57b,Синхронизация По проектам,"Экземпляр: newdoc(https://newdoc.atomsk.ru)
Синхронизация по проектам, Результаты:
Проекты: 31
Дата начала синхронизации: 04.11.2025 23:00:01
Дата окончания синхронизации: 04.11.2025 23:01:09
Длительность синхронизации: 00:01:08
Приложение: PM TSheetsKry_Refresh
Обновления:
	PM_Task:
		Новые: 0
		Обновленные: 0
	PM_TaskAssign:
		Новые: 0
		Обновленные 0:
Ошибки:
	PM_Task: 0
	PM_TaskAssign: 45
	Ошибки сопоставления Ресурсов Pimavera: 0
		Несопоставленные Ресурсы Primavera: 
",2025-11-05 04:01:30
1f099cff-5db8-6efc-8baf-58811e7f31a2,IT-IP. Synch Крайон,1ef822c2-7fd7-66cd-aa65-d7b09a6fc205,1ef822c2-7fd7-66cd-aa65-d7b09a6fc205,1f0ad6f8-adba-663e-999b-04421acbe57b,Синхронизация По проектам,"Экземпляр: newdoc(https://newdoc.atomsk.ru)
Синхронизация по проектам, Результаты:
Проекты: 39
Дата начала синхронизации: 04.11.2025 17:00:01
Дата окончания синхронизации: 04.11.2025 17:01:12
Длительность синхронизации: 00:01:11
Приложение: PM TSheetsKry_Refresh
Обновления:
	PM_Task:
		Новые: 0
		Обновленные: 1
	PM_TaskAssign:
		Новые: 0
		Обновленные 5:
Ошибки:
	PM_Task: 0
	PM_TaskAssign: 45
	Ошибки сопоставления Ресурсов Pimavera: 0
		Несопоставленные Ресурсы Primavera: 
",2025-11-04 22:01:30
1f099cff-5db8-6efc-8baf-58811e7f31a2,IT-IP. Synch Крайон,1ef822c2-7fd7-66cd-aa65-d7b09a6fc205,1ef822c2-7fd7-66cd-aa65-d7b09a6fc205,1f0ad6f8-adba-663e-999b-04421acbe57b,Синхронизация По проектам,"Экземпляр: newdoc(https://newdoc.atomsk.ru)
Синхронизация по проектам, Результаты:
Проекты: 34
Дата начала синхронизации: 03.11.2025 23:00:00
Дата окончания синхронизации: 03.11.2025 23:01:08
Длительность синхронизации: 00:01:08
Приложение: PM TSheetsKry_Refresh
Обновления:
	PM_Task:
		Новые: 0
		Обновленные: 0
	PM_TaskAssign:
		Новые: 0
		Обновленные 0:
Ошибки:
	PM_Task: 0
	PM_TaskAssign: 45
	Ошибки сопоставления Ресурсов Pimavera: 0
		Несопоставленные Ресурсы Primavera: 
",2025-11-04 04:01:33
1f099cff-5db8-6efc-8baf-58811e7f31a2,IT-IP. Synch Крайон,1ef822c2-7fd7-66cd-aa65-d7b09a6fc205,1ef822c2-7fd7-66cd-aa65-d7b09a6fc205,1f0ad6f8-adba-663e-999b-04421acbe57b,Синхронизация По проектам,"Экземпляр: newdoc(https://newdoc.atomsk.ru)
Синхронизация по проектам, Результаты:
Проекты: 31
Дата начала синхронизации: 03.11.2025 17:00:00
Дата окончания синхронизации: 03.11.2025 17:01:16
Длительность синхронизации: 00:01:15
Приложение: PM TSheetsKry_Refresh
Обновления:
	PM_Task:
		Новые: 0
		Обновленные: 0
	PM_TaskAssign:
		Новые: 0
		Обновленные 0:
Ошибки:
	PM_Task: 0
	PM_TaskAssign: 45
	Ошибки сопоставления Ресурсов Pimavera: 0
		Несопоставленные Ресурсы Primavera: 
",2025-11-03 22:01:35
1f099cff-5db8-6efc-8baf-58811e7f31a2,IT-IP. Synch Крайон,1ef822c2-7fd7-66cd-aa65-d7b09a6fc205,1ef822c2-7fd7-66cd-aa65-d7b09a6fc205,1f0ad6f8-adba-663e-999b-04421acbe57b,Синхронизация По проектам,"Экземпляр: newdoc(https://newdoc.atomsk.ru)
Синхронизация по проектам, Результаты:
Проекты: 31
Дата начала синхронизации: 02.11.2025 23:00:00
Дата окончания синхронизации: 02.11.2025 23:01:15
Длительность синхронизации: 00:01:15
Приложение: PM TSheetsKry_Refresh
Обновления:
	PM_Task:
		Новые: 0
		Обновленные: 0
	PM_TaskAssign:
		Новые: 0
		Обновленные 0:
Ошибки:
	PM_Task: 0
	PM_TaskAssign: 45
	Ошибки сопоставления Ресурсов Pimavera: 0
		Несопоставленные Ресурсы Primavera: 
",2025-11-03 04:01:38
1f099cff-5db8-6efc-8baf-58811e7f31a2,IT-IP. Synch Крайон,1ef822c2-7fd7-66cd-aa65-d7b09a6fc205,1ef822c2-7fd7-66cd-aa65-d7b09a6fc205,1f0ad6f8-adba-663e-999b-04421acbe57b,Синхронизация По проектам,"Экземпляр: newdoc(https://newdoc.atomsk.ru)
Синхронизация по проектам, Результаты:
Проекты: 37
Дата начала синхронизации: 02.11.2025 17:00:00
Дата окончания синхронизации: 02.11.2025 17:01:08
Длительность синхронизации: 00:01:07
Приложение: PM TSheetsKry_Refresh
Обновления:
	PM_Task:
		Новые: 0
		Обновленные: 0
	PM_TaskAssign:
		Новые: 0
		Обновленные 0:
Ошибки:
	PM_Task: 0
	PM_TaskAssign: 45
	Ошибки сопоставления Ресурсов Pimavera: 0
		Несопоставленные Ресурсы Primavera: 
",2025-11-02 22:01:27
1f099cff-5db8-6efc-8baf-58811e7f31a2,IT-IP. Synch Крайон,1ef822c2-7fd7-66cd-aa65-d7b09a6fc205,1ef822c2-7fd7-66cd-aa65-d7b09a6fc205,1f0ad6f8-adba-663e-999b-04421acbe57b,Синхронизация По проектам,"Экземпляр: newdoc(https://newdoc.atomsk.ru)
Синхронизация по проектам, Результаты:
Проекты: 42
Дата начала синхронизации: 01.11.2025 23:00:00
Дата окончания синхронизации: 01.11.2025 23:01:02
Длительность синхронизации: 00:01:01
Приложение: PM TSheetsKry_Refresh
Обновления:
	PM_Task:
		Новые: 0
		Обновленные: 0
	PM_TaskAssign:
		Новые: 0
		Обновленные 0:
Ошибки:
	PM_Task: 0
	PM_TaskAssign: 45
	Ошибки сопоставления Ресурсов Pimavera: 0
		Несопоставленные Ресурсы Primavera: 
",2025-11-02 04:01:23
1f099cff-5db8-6efc-8baf-58811e7f31a2,IT-IP. Synch Крайон,1ef822c2-7fd7-66cd-aa65-d7b09a6fc205,1ef822c2-7fd7-66cd-aa65-d7b09a6fc205,1f0ad6f8-adba-663e-999b-04421acbe57b,Синхронизация По проектам,"Экземпляр: newdoc(https://newdoc.atomsk.ru)
Синхронизация по проектам, Результаты:
Проекты: 28
Дата начала синхронизации: 01.11.2025 17:00:01
Дата окончания синхронизации: 01.11.2025 17:20:59
Длительность синхронизации: 00:20:58
Приложение: PM TSheetsKry_Refresh
Обновления:
	PM_Task:
		Новые: 0
		Обновленные: 744
	PM_TaskAssign:
		Новые: 0
		Обновленные 306:
Ошибки:
	PM_Task: 0
	PM_TaskAssign: 45
	Ошибки сопоставления Ресурсов Pimavera: 0
		Несопоставленные Ресурсы Primavera: 
",2025-11-01 22:21:17
1f099cff-5db8-6efc-8baf-58811e7f31a2,IT-IP. Synch Крайон,1ef822c2-7fd7-66cd-aa65-d7b09a6fc205,1ef822c2-7fd7-66cd-aa65-d7b09a6fc205,1f0ad6f8-adba-663e-999b-04421acbe57b,Синхронизация По проектам,"Экземпляр: newdoc(https://newdoc.atomsk.ru)
Синхронизация по проектам, Результаты:
Проекты: 46
Дата начала синхронизации: 31.10.2025 23:00:01
Дата окончания синхронизации: 31.10.2025 23:01:05
Длительность синхронизации: 00:01:04
Приложение: PM TSheetsKry_Refresh
Обновления:
	PM_Task:
		Новые: 0
		Обновленные: 0
	PM_TaskAssign:
		Новые: 0
		Обновленные 0:
Ошибки:
	PM_Task: 0
	PM_TaskAssign: 45
	Ошибки сопоставления Ресурсов Pimavera: 0
		Несопоставленные Ресурсы Primavera: 
",2025-11-01 04:01:29
1f099cff-5db8-6efc-8baf-58811e7f31a2,IT-IP. Synch Крайон,1ef822c2-7fd7-66cd-aa65-d7b09a6fc205,1ef822c2-7fd7-66cd-aa65-d7b09a6fc205,1f0ad6f8-adba-663e-999b-04421acbe57b,Синхронизация По проектам,"Экземпляр: newdoc(https://newdoc.atomsk.ru)
Синхронизация по проектам, Результаты:
Проекты: 11
Дата начала синхронизации: 31.10.2025 17:00:01
Дата окончания синхронизации: 31.10.2025 17:48:18
Длительность синхронизации: 00:48:17
Приложение: PM TSheetsKry_Refresh
Обновления:
	PM_Task:
		Новые: 8
		Обновленные: 2119
	PM_TaskAssign:
		Новые: 33
		Обновленные 578:
Ошибки:
	PM_Task: 0
	PM_TaskAssign: 45
	Ошибки сопоставления Ресурсов Pimavera: 0
		Несопоставленные Ресурсы Primavera: 
",2025-10-31 22:48:36
1f099cff-5db8-6efc-8baf-58811e7f31a2,IT-IP. Synch Крайон,1ef822c2-7fd7-66cd-aa65-d7b09a6fc205,1ef822c2-7fd7-66cd-aa65-d7b09a6fc205,1f0ad6f8-adba-663e-999b-04421acbe57b,Синхронизация По проектам,"Экземпляр: newdoc(https://newdoc.atomsk.ru)
Синхронизация по проектам, Результаты:
Проекты: 1
Дата начала синхронизации: 31.10.2025 10:45:51
Дата окончания синхронизации: 31.10.2025 10:45:56
Длительность синхронизации: 00:00:05
Приложение: PM TSheetsKry_Refresh
Обновления:
	PM_Task:
		Новые: 0
		Обновленные: 0
	PM_TaskAssign:
		Новые: 0
		Обновленные 0:
Ошибки:
	PM_Task: 0
	PM_TaskAssign: 0
	Ошибки сопоставления Ресурсов Pimavera: 0
		Несопоставленные Ресурсы Primavera: 
",2025-10-31 15:46:11
1f099cff-5db8-6efc-8baf-58811e7f31a2,IT-IP. Synch Крайон,1ef822c2-7fd7-66cd-aa65-d7b09a6fc205,1ef822c2-7fd7-66cd-aa65-d7b09a6fc205,1f0ad6f8-adba-663e-999b-04421acbe57b,Синхронизация По проектам,"Экземпляр: newdoc(https://newdoc.atomsk.ru)
Синхронизация по проектам, Результаты:
Проекты: 1
Дата начала синхронизации: 31.10.2025 6:29:25
Дата окончания синхронизации: 31.10.2025 6:29:27
Длительность синхронизации: 00:00:02
Приложение: ITDEV TSheetsKry_Refresh
Обновления:
	PM_Task:
		Новые: 0
		Обновленные: 0
	PM_TaskAssign:
		Новые: 0
		Обновленные 0:
Ошибки:
	PM_Task: 0
	PM_TaskAssign: 0
	Ошибки сопоставления Ресурсов Pimavera: 0
		Несопоставленные Ресурсы Primavera: 
",2025-10-31 11:29:40
1f099cff-5db8-6efc-8baf-58811e7f31a2,IT-IP. Synch Крайон,1ef822c2-7fd7-66cd-aa65-d7b09a6fc205,1ef822c2-7fd7-66cd-aa65-d7b09a6fc205,1f0ad6f8-adba-663e-999b-04421acbe57b,Синхронизация По проектам,"Экземпляр: newdoc(https://newdoc.atomsk.ru)
Синхронизация по проектам, Результаты:
Проекты: 1
Дата начала синхронизации: 31.10.2025 5:32:41
Дата окончания синхронизации: 31.10.2025 5:32:44
Длительность синхронизации: 00:00:03
Приложение: ITDEV TSheetsKry_Refresh
Обновления:
	PM_Task:
		Новые: 0
		Обновленные: 0
	PM_TaskAssign:
		Новые: 0
		Обновленные 0:
Ошибки:
	PM_Task: 0
	PM_TaskAssign: 0
	Ошибки сопоставления Ресурсов Pimavera: 0
		Несопоставленные Ресурсы Primavera: 
",2025-10-31 10:32:57
1f099cff-5db8-6efc-8baf-58811e7f31a2,IT-IP. Synch Крайон,1ef822c2-7fd7-66cd-aa65-d7b09a6fc205,1ef822c2-7fd7-66cd-aa65-d7b09a6fc205,1f0ad6f8-adba-663e-999b-04421acbe57b,Синхронизация По проектам,"Экземпляр: newdoc(https://newdoc.atomsk.ru)
Синхронизация по проектам, Результаты:
Проекты: 1
Дата начала синхронизации: 31.10.2025 5:30:38
Дата окончания синхронизации: 31.10.2025 5:30:41
Длительность синхронизации: 00:00:03
Приложение: ITDEV TSheetsKry_Refresh
Обновления:
	PM_Task:
		Новые: 0
		Обновленные: 0
	PM_TaskAssign:
		Новые: 0
		Обновленные 0:
Ошибки:
	PM_Task: 0
	PM_TaskAssign: 0
	Ошибки сопоставления Ресурсов Pimavera: 0
		Несопоставленные Ресурсы Primavera: 
",2025-10-31 10:30:54
1f099cff-5db8-6efc-8baf-58811e7f31a2,IT-IP. Synch Крайон,1ef822c2-7fd7-66cd-aa65-d7b09a6fc205,1ef822c2-7fd7-66cd-aa65-d7b09a6fc205,1f0ad6f8-adba-663e-999b-04421acbe57b,Синхронизация По проектам,"Экземпляр: newdoc(https://newdoc.atomsk.ru)
Синхронизация по проектам, Результаты:
Проекты: 1
Дата начала синхронизации: 31.10.2025 5:28:53
Дата окончания синхронизации: 31.10.2025 5:28:57
Длительность синхронизации: 00:00:04
Приложение: ITDEV TSheetsKry_Refresh
Обновления:
	PM_Task:
		Новые: 0
		Обновленные: 0
	PM_TaskAssign:
		Новые: 0
		Обновленные 0:
Ошибки:
	PM_Task: 0
	PM_TaskAssign: 0
	Ошибки сопоставления Ресурсов Pimavera: 0
		Несопоставленные Ресурсы Primavera: 
",2025-10-31 10:29:26
1f099cff-5db8-6efc-8baf-58811e7f31a2,IT-IP. Synch Крайон,1ef822c2-7fd7-66cd-aa65-d7b09a6fc205,1ef822c2-7fd7-66cd-aa65-d7b09a6fc205,1f0ad6f8-adba-663e-999b-04421acbe57b,Синхронизация По проектам,"Экземпляр: newdoc(https://newdoc.atomsk.ru)
Синхронизация по проектам, Результаты:
Проекты: 1
Дата начала синхронизации: 31.10.2025 4:58:14
Дата окончания синхронизации: 31.10.2025 5:00:09
Длительность синхронизации: 00:01:55
Приложение: ITDEV TSheetsKry_Refresh
Обновления:
	PM_Task:
		Новые: 0
		Обновленные: 0
	PM_TaskAssign:
		Новые: 0
		Обновленные 0:
Ошибки:
	PM_Task: 0
	PM_TaskAssign: 0
	Ошибки сопоставления Ресурсов Pimavera: 0
		Несопоставленные Ресурсы Primavera: 
",2025-10-31 10:00:23
1f099cff-5db8-6efc-8baf-58811e7f31a2,IT-IP. Synch Крайон,1ef822c2-7fd7-66cd-aa65-d7b09a6fc205,1ef822c2-7fd7-66cd-aa65-d7b09a6fc205,1f0ad6f8-adba-663e-999b-04421acbe57b,Синхронизация По проектам,"Экземпляр: newdoc(https://newdoc.atomsk.ru)
Синхронизация по проектам, Результаты:
Проекты: 1
Дата начала синхронизации: 31.10.2025 4:37:47
Дата окончания синхронизации: 31.10.2025 4:37:51
Длительность синхронизации: 00:00:04
Приложение: ITDEV TSheetsKry_Refresh
Обновления:
	PM_Task:
		Новые: 0
		Обновленные: 0
	PM_TaskAssign:
		Новые: 0
		Обновленные 0:
Ошибки:
	PM_Task: 0
	PM_TaskAssign: 0
	Ошибки сопоставления Ресурсов Pimavera: 0
		Несопоставленные Ресурсы Primavera: 
",2025-10-31 09:38:32
1f099cff-5db8-6efc-8baf-58811e7f31a2,IT-IP. Synch Крайон,1ef822c2-7fd7-66cd-aa65-d7b09a6fc205,1ef822c2-7fd7-66cd-aa65-d7b09a6fc205,1f0ad6f8-adba-663e-999b-04421acbe57b,Синхронизация По проектам,"Cинхронизация по Проектам выполнена, время выполнения 1 минута.
По состоянию на 04:01 31.10.2025:
	Проекты: 73.
	Ошибки отсутствия сопоставления Ресурсов: 45",2025-10-31 08:29:33
1f099cff-5db8-6efc-8baf-58811e7f31a2,IT-IP. Synch Крайон,1ef822c2-7fd7-66cd-aa65-d7b09a6fc205,1ef822c2-7fd7-66cd-aa65-d7b09a6fc205,1f0ad6f8-adba-663e-999b-04421acbe57b,Синхронизация По проектам,"Экземпляр: newdoc(https://newdoc.atomsk.ru)
Синхронизация по проектам, Результаты:
Проекты: 1
Дата начала синхронизации: 30.10.2025 7:07:34
Дата окончания синхронизации: 30.10.2025 7:07:39
Длительность синхронизации: 00:00:04
Приложение: ITDEV TSheetsKry_Refresh
Обновления:
	PM_Task:
		Новые: 0
		Обновленные: 0
	PM_TaskAssign:
		Новые: 0
		Обновленные 0:
Ошибки:
	PM_Task: 0
	PM_TaskAssign: 0
	Ошибки сопоставления Ресурсов Pimavera: 0
		Несопоставленные Ресурсы Primavera: 
",2025-10-30 12:08:01
1f099cff-5db8-6efc-8baf-58811e7f31a2,IT-IP. Synch Крайон,1ef822c2-7fd7-66cd-aa65-d7b09a6fc205,1ef822c2-7fd7-66cd-aa65-d7b09a6fc205,1f0ad6f8-adba-663e-999b-04421acbe57b,Синхронизация По проектам,"Экземпляр: newdoc(https://newdoc.atomsk.ru)
Синхронизация по проектам, Результаты:
Проекты: 1
Дата начала синхронизации: 30.10.2025 6:56:10
Дата окончания синхронизации: 30.10.2025 6:56:15
Длительность синхронизации: 00:00:05
Приложение: ITDEV TSheetsKry_Refresh
Обновления:
	PM_Task:
		Новые: 0
		Обновленные: 0
	PM_TaskAssign:
		Новые: 0
		Обновленные 0:
Ошибки:
	PM_Task: 0
	PM_TaskAssign: 0
	Ошибки сопоставления Ресурсов Pimavera: 0
		Несопоставленные Ресурсы Primavera: 
",2025-10-30 11:56:47
1f099cff-5db8-6efc-8baf-58811e7f31a2,IT-IP. Synch Крайон,1ef822c2-7fd7-66cd-aa65-d7b09a6fc205,1ef822c2-7fd7-66cd-aa65-d7b09a6fc205,1f0ad6f8-adba-663e-999b-04421acbe57b,Синхронизация По проектам,"Cинхронизация по Проектам выполнена, время выполнения 1 минута.
По состоянию на 04:01 30.10.2025:
	Проекты: 73.
	Ошибки отсутствия сопоставления Ресурсов: 45",2025-10-30 08:23:46
1f099cff-5db8-6efc-8baf-58811e7f31a2,IT-IP. Synch Крайон,1ef822c2-7fd7-66cd-aa65-d7b09a6fc205,1ef822c2-7fd7-66cd-aa65-d7b09a6fc205,1f0ad6f8-adba-663e-999b-04421acbe57b,Синхронизация По проектам,"Экземпляр: newdoc(https://newdoc.atomsk.ru)
Синхронизация по проектам, Результаты:
Проекты: 1
Дата начала синхронизации: 29.10.2025 11:25:43
Дата окончания синхронизации: 29.10.2025 11:25:48
Длительность синхронизации: 00:00:05
Приложение: ITDEV TSheetsKry_Refresh
Обновления:
	PM_Task:
		Новые: 0
		Обновленные: 0
	PM_TaskAssign:
		Новые: 0
		Обновленные 0:
Ошибки:
	PM_Task: 0
	PM_TaskAssign: 0
	Ошибки сопоставления Ресурсов Pimavera: 0
		Несопоставленные Ресурсы Primavera: 
",2025-10-29 16:26:23
1f099cff-5db8-6efc-8baf-58811e7f31a2,IT-IP. Synch Крайон,1ef822c2-7fd7-66cd-aa65-d7b09a6fc205,1ef822c2-7fd7-66cd-aa65-d7b09a6fc205,1f0ad6f8-adba-663e-999b-04421acbe57b,Синхронизация По проектам,"Cинхронизация по Проектам выполнена, время выполнения 1 минута.
По состоянию на 04:01 29.10.2025:
	Проекты: 73.
	Ошибки отсутствия сопоставления Ресурсов: 45",2025-10-29 13:14:10
1f099cff-5db8-6efc-8baf-58811e7f31a2,IT-IP. Synch Крайон,1ef822c2-7fd7-66cd-aa65-d7b09a6fc205,1ef822c2-7fd7-66cd-aa65-d7b09a6fc205,1efa64e1-39d9-6dc6-82c8-6cb3115313f8,Евгения Мельникова,готово,2025-10-28 10:20:45
1f099cff-5db8-6efc-8baf-58811e7f31a2,IT-IP. Synch Крайон,1ef822c2-7fd7-66cd-aa65-d7b09a6fc205,1ef822c2-7fd7-66cd-aa65-d7b09a6fc205,1ef8ca29-54ab-68ba-ba70-a0423f4d30a4,Владимир Летучев,"<@u:1efa64e1-39d9-6dc6-82c8-6cb3115313f8> 
Евгения, добавьте, пожалуйста, в этот канал две учетные записи:
syncprimavera_project
syncprimavera_executor",2025-10-28 10:19:31
1f099cff-5db8-6efc-8baf-58811e7f31a2,IT-IP. Synch Крайон,1ef822c2-7fd7-66cd-aa65-d7b09a6fc205,1ef822c2-7fd7-66cd-aa65-d7b09a6fc205,1ef8ca29-54ab-68ba-ba70-a0423f4d30a4,Владимир Летучев,"Cинхронизация по Проектам выполнена, время выполнения 1 минута.
По состоянию на 04:01 28.10.2025:
	Проекты: 73.
	Ошибки отсутствия сопоставления Ресурсов: 45",2025-10-28 10:04:18
1f099cff-5db8-6efc-8baf-58811e7f31a2,IT-IP. Synch Крайон,1ef822c2-7fd7-66cd-aa65-d7b09a6fc205,1ef822c2-7fd7-66cd-aa65-d7b09a6fc205,1ef8ca29-54ab-68ba-ba70-a0423f4d30a4,Владимир Летучев,"Экземпляр: newdoc(https://newdoc.atomsk.ru)
Синхронизация по проектам, Результаты:
Проекты: 1
Дата начала синхронизации: 28.10.2025 3:20:52
Дата окончания синхронизации: 28.10.2025 3:20:59
Длительность синхронизации: 00:00:07
Приложение: ITDEV TSheetsKry_Refresh
Обновления:
	PM_Task:
		Новые: 0
		Обновленные: 0
	PM_TaskAssign:
		Новые: 0
		Обновленные 0:
Ошибки:
	PM_Task: 0
	PM_TaskAssign: 0
	Ошибки сопоставления Ресурсов Pimavera: 0
		Несопоставленные Ресурсы Primavera: 
",2025-10-28 08:21:14
1f099cff-5db8-6efc-8baf-58811e7f31a2,IT-IP. Synch Крайон,1ef822c2-7fd7-66cd-aa65-d7b09a6fc205,1ef822c2-7fd7-66cd-aa65-d7b09a6fc205,1ef8ca29-54ab-68ba-ba70-a0423f4d30a4,Владимир Летучев,"Cинхронизация по Проектам выполнена, время выполнения 13 минут.
По состоянию на 04:13 27.10.2025:
	Проекты: 73.
	Ошибки отсутствия сопоставления Ресурсов: 45",2025-10-27 09:52:46
1f099cff-5db8-6efc-8baf-58811e7f31a2,IT-IP. Synch Крайон,1ef822c2-7fd7-66cd-aa65-d7b09a6fc205,1ef822c2-7fd7-66cd-aa65-d7b09a6fc205,1ef8ca29-54ab-68ba-ba70-a0423f4d30a4,Владимир Летучев,Нет данных,2025-10-24 10:06:27
1f099cff-5db8-6efc-8baf-58811e7f31a2,IT-IP. Synch Крайон,1ef822c2-7fd7-66cd-aa65-d7b09a6fc205,1ef822c2-7fd7-66cd-aa65-d7b09a6fc205,1ef8ca29-54ab-68ba-ba70-a0423f4d30a4,Владимир Летучев,"Cинхронизация по Проектам выполнена, время выполнения 1минута.
По состоянию на 04:01 24.10.2025:
	Проекты: 73.
	Ошибки отсутствия сопоставления Ресурсов: 45",2025-10-24 08:39:33
1f099cff-5db8-6efc-8baf-58811e7f31a2,IT-IP. Synch Крайон,1ef822c2-7fd7-66cd-aa65-d7b09a6fc205,1ef822c2-7fd7-66cd-aa65-d7b09a6fc205,1ef8ca29-54ab-68ba-ba70-a0423f4d30a4,Владимир Летучев,"Cинхронизация по Проектам выполнена, время выполнения 1минута.
По состоянию на 04:16 23.10.2025:
	Проекты: 73.
	Ошибки отсутствия сопоставления Ресурсов: 45",2025-10-23 09:22:06
1f099cff-5db8-6efc-8baf-58811e7f31a2,IT-IP. Synch Крайон,1ef822c2-7fd7-66cd-aa65-d7b09a6fc205,1ef822c2-7fd7-66cd-aa65-d7b09a6fc205,1ef8ca29-54ab-68ba-ba70-a0423f4d30a4,Владимир Летучев,"Экземпляр: newdoc(https://newdoc.atomsk.ru)
Синхронизация по проектам, Результаты:
Проекты: 1
Обновления:
	PM_Task:
		Новые: 0
		Обновленные: 0
	PM_TaskAssign:
		Новые: 0
		Обновленные 0:
Ошибки:
	PM_Task: 0
	PM_TaskAssign: 0
	Ошибки сопоставления Ресурсов Pimavera: 0
		Несопоставленные Ресурсы Primavera: 

Id: 48655
Parent: 
ProjectId: TestTable
ProjectGuid: 0c235e60-3fc8-4dc0-8bda-5297f224800e
Finished: 23.10.2025 3:43:12
Tasks_EntryJ: {""TasksCnt"":null,""ActivitiesCnt"":0,""TasksToCreateCnt"":null,""TasksToEditCnt"":null}
Tasks_ResultJ: {""NewTasksCnt"":0,""ErrorTasksCnt"":0,""UpdatedTasksCnt"":0,""ErrorUpdTasksCnt"":0,""Finished"":""2025-10-23T03:43:12.6565066Z""}
TasksErrors_Cnt: 
TaskAssigns_EntryJ: {""TaskAssignsCnt"":null,""RsrcAssignmentsCnt"":0,""TaskAssignsToCreateCnt"":null,""TaskAssignsToEditCnt"":null}
TaskAssigns_ResultJ: {""NewTaskAssignsCnt"":0,""ErrorTaskAssignsCnt"":0,""UpdatedTaskAssignsCnt"":0,""ErrorUpdTaskAssignsCnt"":0,""Finished"":""2025-10-23T03:43:12.8514393Z""}
TaskAssignsErrors_Cnt: 
",2025-10-23 08:43:31
1f099cff-5db8-6efc-8baf-58811e7f31a2,IT-IP. Synch Крайон,1ef822c2-7fd7-66cd-aa65-d7b09a6fc205,1ef822c2-7fd7-66cd-aa65-d7b09a6fc205,1ef8ca29-54ab-68ba-ba70-a0423f4d30a4,Владимир Летучев,"Экземпляр: newdoc(https://newdoc.atomsk.ru)
Синхронизация по проектам, Результаты:
Проекты: 1
Обновления:
	PM_Task:
		Новые: 1
		Обновленные: 1
	PM_TaskAssign:
		Новые: 1
		Обновленные 1:
Ошибки:
	PM_Task: 0
	PM_TaskAssign: 0
	Ошибки сопоставления Ресурсов Pimavera: 0
		Несопоставленные Ресурсы Primavera: 

Id: 48262
Parent: 
ProjectId: TestTable
ProjectGuid: 0c235e60-3fc8-4dc0-8bda-5297f224800e
Finished: 17.10.2025 10:13:40
Tasks_EntryJ: {""TasksCnt"":null,""ActivitiesCnt"":2,""TasksToCreateCnt"":null,""TasksToEditCnt"":null}
Tasks_ResultJ: {""NewTasksCnt"":1,""ErrorTasksCnt"":0,""UpdatedTasksCnt"":1,""ErrorUpdTasksCnt"":0,""Finished"":""2025-10-17T10:13:38.336949Z""}
TasksErrors_Cnt: 
TaskAssigns_EntryJ: {""TaskAssignsCnt"":null,""RsrcAssignmentsCnt"":2,""TaskAssignsToCreateCnt"":null,""TaskAssignsToEditCnt"":null}
TaskAssigns_ResultJ: {""NewTaskAssignsCnt"":1,""ErrorTaskAssignsCnt"":0,""UpdatedTaskAssignsCnt"":1,""ErrorUpdTaskAssignsCnt"":0,""Finished"":""2025-10-17T10:13:40.4721631Z""}
TaskAssignsErrors_Cnt: 
",2025-10-17 15:13:56
1f099cff-5db8-6efc-8baf-58811e7f31a2,IT-IP. Synch Крайон,1ef822c2-7fd7-66cd-aa65-d7b09a6fc205,1ef822c2-7fd7-66cd-aa65-d7b09a6fc205,1ef8ca29-54ab-68ba-ba70-a0423f4d30a4,Владимир Летучев,"Экземпляр: newdoc(https://newdoc.atomsk.ru)
Синхронизация по проектам, Результаты:
Проекты: 1
Обновления:
	PM_Task:
		Новые: 1
		Обновленные: 0
	PM_TaskAssign:
		Новые: 28
		Обновленные 0:
Ошибки:
	PM_Task: 0
	PM_TaskAssign: 2
	Ошибки сопоставления Ресурсов Pimavera: 0
		Несопоставленные Ресурсы Primavera: 

Id: 48257
Parent: 
ProjectId: Учеба.ВГ
ProjectGuid: 7e84758e-3594-4e63-a3c0-c3887ce1a13a
Finished: 17.10.2025 5:27:00
Tasks_EntryJ: {""TasksCnt"":null,""ActivitiesCnt"":1,""TasksToCreateCnt"":null,""TasksToEditCnt"":null}
Tasks_ResultJ: {""NewTasksCnt"":1,""ErrorTasksCnt"":0,""UpdatedTasksCnt"":0,""ErrorUpdTasksCnt"":0,""Finished"":""2025-10-17T05:26:33.1707207Z""}
TasksErrors_Cnt: 
TaskAssigns_EntryJ: {""TaskAssignsCnt"":null,""RsrcAssignmentsCnt"":30,""TaskAssignsToCreateCnt"":null,""TaskAssignsToEditCnt"":null}
TaskAssigns_ResultJ: {""NewTaskAssignsCnt"":28,""ErrorTaskAssignsCnt"":2,""UpdatedTaskAssignsCnt"":0,""ErrorUpdTaskAssignsCnt"":0,""Finished"":""2025-10-17T05:27:00.1293853Z""}
TaskAssignsErrors_Cnt: 2
",2025-10-17 10:27:17
1f099cff-5db8-6efc-8baf-58811e7f31a2,IT-IP. Synch Крайон,1ef822c2-7fd7-66cd-aa65-d7b09a6fc205,1ef822c2-7fd7-66cd-aa65-d7b09a6fc205,1ef8ca29-54ab-68ba-ba70-a0423f4d30a4,Владимир Летучев,"Cинхронизации по Проектам выполнены, время выполнения последней 1 минута.
По состоянию на 04:01 17.10.2025:
	Проекты: 73.
	Ошибки отсутствия сопоставления Ресурсов: 45",2025-10-17 09:31:37
1f099cff-5db8-6efc-8baf-58811e7f31a2,IT-IP. Synch Крайон,1ef822c2-7fd7-66cd-aa65-d7b09a6fc205,1ef822c2-7fd7-66cd-aa65-d7b09a6fc205,1ef8ca29-54ab-68ba-ba70-a0423f4d30a4,Владимир Летучев,"Экземпляр: newdoc(https://newdoc.atomsk.ru)
Синхронизация по проектам, Результаты:
Проекты: 1
Обновления:
	PM_Task:
		Новые: 0
		Обновленные: 0
	PM_TaskAssign:
		Новые: 0
		Обновленные 0:
Ошибки:
	PM_Task: 0
	PM_TaskAssign: 0
	Ошибки сопоставления Ресурсов Pimavera: 0
		Несопоставленные Ресурсы Primavera: 

Id: 48091
Parent: 
ProjectId: TestTable
ProjectGuid: 0c235e60-3fc8-4dc0-8bda-5297f224800e
Finished: 16.10.2025 5:07:53
Tasks_EntryJ: {""TasksCnt"":null,""ActivitiesCnt"":0,""TasksToCreateCnt"":null,""TasksToEditCnt"":null}
Tasks_ResultJ: {""NewTasksCnt"":0,""ErrorTasksCnt"":0,""UpdatedTasksCnt"":0,""ErrorUpdTasksCnt"":0,""Finished"":""2025-10-16T05:07:52.9403009Z""}
TasksErrors_Cnt: 
TaskAssigns_EntryJ: {""TaskAssignsCnt"":null,""RsrcAssignmentsCnt"":0,""TaskAssignsToCreateCnt"":null,""TaskAssignsToEditCnt"":null}
TaskAssigns_ResultJ: {""NewTaskAssignsCnt"":0,""ErrorTaskAssignsCnt"":0,""UpdatedTaskAssignsCnt"":0,""ErrorUpdTaskAssignsCnt"":0,""Finished"":""2025-10-16T05:07:53.0632753Z""}
TaskAssignsErrors_Cnt: 
",2025-10-16 10:08:08
1f099cff-5db8-6efc-8baf-58811e7f31a2,IT-IP. Synch Крайон,1ef822c2-7fd7-66cd-aa65-d7b09a6fc205,1ef822c2-7fd7-66cd-aa65-d7b09a6fc205,1ef8ca29-54ab-68ba-ba70-a0423f4d30a4,Владимир Летучев,"Cинхронизации по Проектам выполнены, время выполнения последней 1 минутf.
По состоянию на 04:01 16.10.2025:
	Проекты: 73.
	Ошибки отсутствия сопоставления Ресурсов: 45",2025-10-16 09:48:22
1f099cff-5db8-6efc-8baf-58811e7f31a2,IT-IP. Synch Крайон,1ef822c2-7fd7-66cd-aa65-d7b09a6fc205,1ef822c2-7fd7-66cd-aa65-d7b09a6fc205,1ef8ca29-54ab-68ba-ba70-a0423f4d30a4,Владимир Летучев,"Экземпляр: newdoc(https://newdoc.atomsk.ru)
Синхронизация по проектам, Результаты:
Проекты: 1
Обновления:
	PM_Task:
		Новые: 0
		Обновленные: 0
	PM_TaskAssign:
		Новые: 0
		Обновленные 0:
Ошибки:
	PM_Task: 0
	PM_TaskAssign: 0
	Ошибки сопоставления Ресурсов Pimavera: 0
		Несопоставленные Ресурсы Primavera: 

Id: 48090
Parent: 
ProjectId: TestTable
ProjectGuid: 0c235e60-3fc8-4dc0-8bda-5297f224800e
Finished: 16.10.2025 4:43:38
Tasks_EntryJ: {""TasksCnt"":null,""ActivitiesCnt"":0,""TasksToCreateCnt"":null,""TasksToEditCnt"":null}
Tasks_ResultJ: {""NewTasksCnt"":0,""ErrorTasksCnt"":0,""UpdatedTasksCnt"":0,""ErrorUpdTasksCnt"":0,""Finished"":""2025-10-16T04:43:38.4469899Z""}
TasksErrors_Cnt: 
TaskAssigns_EntryJ: {""TaskAssignsCnt"":null,""RsrcAssignmentsCnt"":0,""TaskAssignsToCreateCnt"":null,""TaskAssignsToEditCnt"":null}
TaskAssigns_ResultJ: {""NewTaskAssignsCnt"":0,""ErrorTaskAssignsCnt"":0,""UpdatedTaskAssignsCnt"":0,""ErrorUpdTaskAssignsCnt"":0,""Finished"":""2025-10-16T04:43:38.5979373Z""}
TaskAssignsErrors_Cnt: 
",2025-10-16 09:43:54
1f099cff-5db8-6efc-8baf-58811e7f31a2,IT-IP. Synch Крайон,1ef822c2-7fd7-66cd-aa65-d7b09a6fc205,1ef822c2-7fd7-66cd-aa65-d7b09a6fc205,1ef8ca29-54ab-68ba-ba70-a0423f4d30a4,Владимир Летучев,"Cинхронизации по Проектам выполнены, время выполнения последней 1.5 минуты.
По состоянию на 04:02 15.10.2025:
	Проекты: 73.
	Ошибки отсутствия сопоставления Ресурсов: 45",2025-10-15 18:08:25
1f099cff-5db8-6efc-8baf-58811e7f31a2,IT-IP. Synch Крайон,1ef822c2-7fd7-66cd-aa65-d7b09a6fc205,1ef822c2-7fd7-66cd-aa65-d7b09a6fc205,1ef8ca29-54ab-68ba-ba70-a0423f4d30a4,Владимир Летучев,"Cинхронизации по Проектам выполнены, время выполнения последней 1.5 минуты.
По состоянию на 04:02 15.10.2025:
	Проекты: 73.
	Ошибки отсутствия сопоставления Ресурсов: 45",2025-10-15 18:03:51
1f099cff-5db8-6efc-8baf-58811e7f31a2,IT-IP. Synch Крайон,1ef822c2-7fd7-66cd-aa65-d7b09a6fc205,1ef822c2-7fd7-66cd-aa65-d7b09a6fc205,1ef8ca29-54ab-68ba-ba70-a0423f4d30a4,Владимир Летучев,"Cинхронизации по Проектам выполнены, время выполнения последней 1.5 минуты.
По состоянию на 04:02 14.10.2025:
	Проекты: 73.
	Ошибки отсутствия сопоставления Ресурсов: 45",2025-10-14 08:34:38
1f099cff-5db8-6efc-8baf-58811e7f31a2,IT-IP. Synch Крайон,1ef822c2-7fd7-66cd-aa65-d7b09a6fc205,1ef822c2-7fd7-66cd-aa65-d7b09a6fc205,1ef8ca29-54ab-68ba-ba70-a0423f4d30a4,Владимир Летучев,"Экземпляр: newdoc(https://newdoc.atomsk.ru)
Синхронизация по проектам, Результаты:
Проекты: 1
Обновления:
	PM_Task:
		Новые: 0
		Обновленные: 0
	PM_TaskAssign:
		Новые: 0
		Обновленные 0:
Ошибки:
	PM_Task: 0
	PM_TaskAssign: 0
	Ошибки сопоставления Ресурсов Pimavera: 0
		Несопоставленные Ресурсы Primavera: 

Id: 47595
Parent: 
ProjectId: TestTable
ProjectGuid: 0c235e60-3fc8-4dc0-8bda-5297f224800e
Finished: 13.10.2025 11:05:57
Tasks_EntryJ: {""TasksCnt"":null,""ActivitiesCnt"":0,""TasksToCreateCnt"":null,""TasksToEditCnt"":null}
Tasks_ResultJ: {""NewTasksCnt"":0,""ErrorTasksCnt"":0,""UpdatedTasksCnt"":0,""ErrorUpdTasksCnt"":0,""Finished"":""2025-10-13T11:05:57.5661801Z""}
TasksErrors_Cnt: 
TaskAssigns_EntryJ: {""TaskAssignsCnt"":null,""RsrcAssignmentsCnt"":0,""TaskAssignsToCreateCnt"":null,""TaskAssignsToEditCnt"":null}
TaskAssigns_ResultJ: {""NewTaskAssignsCnt"":0,""ErrorTaskAssignsCnt"":0,""UpdatedTaskAssignsCnt"":0,""ErrorUpdTaskAssignsCnt"":0,""Finished"":""2025-10-13T11:05:57.710131Z""}
TaskAssignsErrors_Cnt: 
",2025-10-13 16:06:39
1f099cff-5db8-6efc-8baf-58811e7f31a2,IT-IP. Synch Крайон,1ef822c2-7fd7-66cd-aa65-d7b09a6fc205,1ef822c2-7fd7-66cd-aa65-d7b09a6fc205,1ef8ca29-54ab-68ba-ba70-a0423f4d30a4,Владимир Летучев,"Экземпляр: newdoc(https://newdoc.atomsk.ru)
Результаты плановой синхронизации:
Проекты: 1
Обновления:
	PM_Task:
		Новые: 0
		Обновленные: 0
	PM_TaskAssign:
		Новые: 0
		Обновленные 0:
Ошибки:
	PM_Task: 0
	PM_TaskAssign: 0
	Ошибки сопоставления Ресурсов Pimavera: 0
		Несопоставленные Ресурсы Primavera: 

Id: 47594
Parent: 
ProjectId: TestTable
ProjectGuid: 0c235e60-3fc8-4dc0-8bda-5297f224800e
Finished: 13.10.2025 10:33:18
Tasks_EntryJ: {""TasksCnt"":null,""ActivitiesCnt"":0,""TasksToCreateCnt"":null,""TasksToEditCnt"":null}
Tasks_ResultJ: {""NewTasksCnt"":0,""ErrorTasksCnt"":0,""UpdatedTasksCnt"":0,""ErrorUpdTasksCnt"":0,""Finished"":""2025-10-13T10:33:18.3652134Z""}
TasksErrors_Cnt: 
TaskAssigns_EntryJ: {""TaskAssignsCnt"":null,""RsrcAssignmentsCnt"":0,""TaskAssignsToCreateCnt"":null,""TaskAssignsToEditCnt"":null}
TaskAssigns_ResultJ: {""NewTaskAssignsCnt"":0,""ErrorTaskAssignsCnt"":0,""UpdatedTaskAssignsCnt"":0,""ErrorUpdTaskAssignsCnt"":0,""Finished"":""2025-10-13T10:33:18.584143Z""}
TaskAssignsErrors_Cnt: 
",2025-10-13 15:33:56
1f099cff-5db8-6efc-8baf-58811e7f31a2,IT-IP. Synch Крайон,1ef822c2-7fd7-66cd-aa65-d7b09a6fc205,1ef822c2-7fd7-66cd-aa65-d7b09a6fc205,1ef8ca29-54ab-68ba-ba70-a0423f4d30a4,Владимир Летучев,"Cинхронизации по Проектам выполнены, время выполнения последней 6 минут.
По состоянию на 04:06 13.10.2025:
	Проекты: 73.
	Ошибки отсутствия сопоставления Ресурсов: 45",2025-10-13 08:35:38
1f099cff-5db8-6efc-8baf-58811e7f31a2,IT-IP. Synch Крайон,1ef822c2-7fd7-66cd-aa65-d7b09a6fc205,1ef822c2-7fd7-66cd-aa65-d7b09a6fc205,1ef8ca29-54ab-68ba-ba70-a0423f4d30a4,Владимир Летучев,"Cинхронизации по Проектам выполнены, время выполнения последней 1 минута.
По состоянию на 04:01 10.10.2025:
	Проекты: 73.
	Ошибки отсутствия сопоставления Ресурсов: 45",2025-10-10 08:50:58
1f099cff-5db8-6efc-8baf-58811e7f31a2,IT-IP. Synch Крайон,1ef822c2-7fd7-66cd-aa65-d7b09a6fc205,1ef822c2-7fd7-66cd-aa65-d7b09a6fc205,1ef8ca29-54ab-68ba-ba70-a0423f4d30a4,Владимир Летучев,"Cинхронизации по Проектам выполнены, время выполнения последней 1 минута.
По состоянию на 04:01 10.10.2025:
    Проекты: 73.
    Ошибки отсутствия сопоставления Ресурсов: 45",2025-10-10 08:48:09
1f099cff-5db8-6efc-8baf-58811e7f31a2,IT-IP. Synch Крайон,1ef822c2-7fd7-66cd-aa65-d7b09a6fc205,1ef822c2-7fd7-66cd-aa65-d7b09a6fc205,1ef8ca29-54ab-68ba-ba70-a0423f4d30a4,Владимир Летучев,"Cинхронизации по Проектам выполнены, время выполнения последней 1 минута.
По состоянию на 04:01 09.10.2025:
	Проекты: 73.
	Ошибки отсутствия сопоставления Ресурсов: 45",2025-10-09 09:17:37
1f099cff-5db8-6efc-8baf-58811e7f31a2,IT-IP. Synch Крайон,1ef822c2-7fd7-66cd-aa65-d7b09a6fc205,1ef822c2-7fd7-66cd-aa65-d7b09a6fc205,1ef8ca29-54ab-68ba-ba70-a0423f4d30a4,Владимир Летучев,"Cинхронизации по Проектам выполнены, время выполнения последней 5 минут.
По состоянию на 04:06 08.10.2025:
	Проекты: 73.
	Ошибки отсутствия сопоставления Ресурсов: 45",2025-10-08 08:29:31
1f099cff-5db8-6efc-8baf-58811e7f31a2,IT-IP. Synch Крайон,1ef822c2-7fd7-66cd-aa65-d7b09a6fc205,1ef822c2-7fd7-66cd-aa65-d7b09a6fc205,1ef8ca29-54ab-68ba-ba70-a0423f4d30a4,Владимир Летучев,"Cинхронизация по Проектам выполнена, время выполнения 20 минут.
По состоянию на 08:46 07.10.2025:
	Проекты: 73.
	Ошибки отсутствия сопоставления Ресурсов: 45",2025-10-07 09:02:49
1f099cff-5db8-6efc-8baf-58811e7f31a2,IT-IP. Synch Крайон,1ef822c2-7fd7-66cd-aa65-d7b09a6fc205,1ef822c2-7fd7-66cd-aa65-d7b09a6fc205,1ef8ca29-54ab-68ba-ba70-a0423f4d30a4,Владимир Летучев,"Cинхронизация по Проектам выполнена, время выполнения 56 минут.
По состоянию на 10:46 06.10.2025:
	Проекты: 73.
	Ошибки отсутствия сопоставления Ресурсов: 45",2025-10-06 11:32:11
1f099cff-5db8-6efc-8baf-58811e7f31a2,IT-IP. Synch Крайон,1ef822c2-7fd7-66cd-aa65-d7b09a6fc205,1ef822c2-7fd7-66cd-aa65-d7b09a6fc205,1ef8ca29-54ab-68ba-ba70-a0423f4d30a4,Владимир Летучев,В работе...,2025-10-01 10:36:41
1f099cff-5db8-6efc-8baf-58811e7f31a2,IT-IP. Synch Крайон,1ef822c2-7fd7-66cd-aa65-d7b09a6fc205,1ef822c2-7fd7-66cd-aa65-d7b09a6fc205,1ef8c872-8e73-63f8-a020-a0423f4d30a4,Мария Оносова,А когда будет настроена автатическая публикация?,2025-10-01 10:00:31
1f099cff-5db8-6efc-8baf-58811e7f31a2,IT-IP. Synch Крайон,1ef822c2-7fd7-66cd-aa65-d7b09a6fc205,1ef822c2-7fd7-66cd-aa65-d7b09a6fc205,1ef8ca29-54ab-68ba-ba70-a0423f4d30a4,Владимир Летучев,"Cинхронизация по Проектам выполнена.
По состоянию на утро 01.10.2025:
	Проекты: 73.
	Ошибки отсутствия сопоставления Ресурсов: 45",2025-10-01 09:43:34
1f099cff-5db8-6efc-8baf-58811e7f31a2,IT-IP. Synch Крайон,1ef822c2-7fd7-66cd-aa65-d7b09a6fc205,1ef822c2-7fd7-66cd-aa65-d7b09a6fc205,1ef8ca29-54ab-68ba-ba70-a0423f4d30a4,Владимир Летучев,"Cинхронизациz по Проектам выполненf.
По состоянию на утро 30.09.2025:
	Проекты: 73.
	Ошибки отсутствия сопоставления Ресурсов: 45",2025-09-30 09:27:34
1f099cff-5db8-6efc-8baf-58811e7f31a2,IT-IP. Synch Крайон,1ef822c2-7fd7-66cd-aa65-d7b09a6fc205,1ef822c2-7fd7-66cd-aa65-d7b09a6fc205,1ef8ca29-54ab-68ba-ba70-a0423f4d30a4,Владимир Летучев,"Две пары синхронизации по Проектам выходных дней выполнены.
По состоянию на утро 29.09.2025:
	Проекты: 72.
	Ошибки отсутствия сопоставления Ресурсов: 45",2025-09-29 09:26:53
1f099cff-5db8-6efc-8baf-58811e7f31a2,IT-IP. Synch Крайон,1ef822c2-7fd7-66cd-aa65-d7b09a6fc205,1ef822c2-7fd7-66cd-aa65-d7b09a6fc205,1ef8ca29-54ab-68ba-ba70-a0423f4d30a4,Владимир Летучев,"Тестируем отправку сообщения
Попытка 01",2025-09-25 16:18:18
